date,score,score_category,review
2016.03.03,-,-,"포도호텔과 같은 계열로 좀 더 합리적인 가격에 이용할 수 있다기에 냉큼 예약했던 디아넥스 호텔. 도착하자마자 호텔의 차분하고 조용한 분위기가 여행의 여정에 지쳐있던 몸을 편안하게 해주었습니다. 호텔의 인테리어 하나하나가 굉장히 고급스럽고 차분한 느낌이어서 더욱 더 좋았던 것 같습니다. 특히, 출입구에 들어서자마자 보이는 테라스와 조식공간 옆의 작은 호수는 디아넥스에서 여유롭게 쉴 수 있게 도와주는 경관이었습니다. 친절한 리셉션의 도움으로 3층 객실 안내를 받고, 방으로 들어오니 바로 펼쳐지는 탁 트인 제주의 전경! 어떤 섬인지는 모르겠으나 작은 섬 하나와 드넓은 수평선을 보며 매우 감탄을 했더랍니다^^ (물론 바다 바로 앞에 있는 호텔들의 전경과는 비교할 수 없겠지만, 드넓은 바다를 멀리서 바라보는 것도 참 좋더군요!) 침실, 화장실, 그 외 가구들과 전등들까지 매우 차분한 느낌의 인테리어 였습니다. 따뜻하고 어두운 톤의 인테리어라 도착하자 짐을 풀고 낮 여정으로 인해 잠시 잠이 들었는데 잠깐의 잠이었지만 푹 잠 들었던 것 같습니다^^ 저녁 일정을 위해 다른 곳으로 나갔다가 다시 호텔로 돌아오려고 하는데, 그 날이 눈바람이 심하게 불던 날이라 리셉션에서 저희의 안전을 위해 직접 전화를 주셔서 오는 길이 눈과 바람으로 위험하니 안전하게 들어오시라고 전화를 주셨습니다. 여기서 저는 디아넥스의 고객을 위한 사려깊은 서비스를 느낄 수 있었습니다. 다시 오게 만들고 싶던 이유 중에 하나지요^^! 덕분에 너무 늦지 않게 안전하게 잘 도착하여 하룻밤을 편안히 잘 수 있었습니다. 다음 날은 온천과 수영장을 이용하였는데, 이른 아침시간이라 사람이 없어 조용하게 이용할 수 있었습니다. 아라고나이트 성분의 온천수로 목욕하는 기분이 참 좋더군요. 전날의 여정으로 쌓인 피로를 풀어준 후, 제가 너무나도 좋아하는 수영을 하러 온천장과 바로 이어진 수영장으로 갔습니다! (디아넥스에 오기 전, 사진을 보며 제일 기대했던 수영장! 뚜둥!) 탁 트인 유리 천장과 앞창문이 제주의 아름다운 전경을 보여주어서 황홀했던 수영이었습니다! 덧붙여 수영장 타일이 푸른색이어서 더욱 탁 트인 느낌이 들었던 것 같습니다^^ 아무도 없는 수영장에서 탁 트인 천장의 하늘을 바라보며 모처럼 편안히 쉼을 누릴 수 있었습니다. 물온도도 따뜻하니 아주 수영하기 좋게 맞춰주셨습니다. 수영을 끝낸 후, 노천온천탕에 가서 다시 한 번 몸을 풀어주러 갔는데 여기 또한 절경입니다ㅜㅜ 그날따라 바람이 매우 세게 불던 날이라 수영한 후 나가니 칼바람을 맞아 너무 추웠으나 탕에 들어가자마자 언제 추웠냐는듯 온몸이 따뜻해졌습니다. 파란 하늘을 바로 마주하며 제주의 바람을 느끼며 온천하는 느낌이란! 이루 말할 수 없이 좋습니다!!ㅋㅋ (온천과 수영장 때문에 다시 꼭 가고싶어요!!!) 수영하느냐 시간이 금세 가버려 조식시간을 놓칠까 조마조마했는데 조식시간이 11시까지 꽤 긴 편이라 다행히 먹을 수 있었습니다. 3가지 종류의 빵, 소시지, 베이컨, 에그스크램블, 샐러드, 국, 죽, 밥, 밑반찬 몇가지, 쥬스, 커피 등 가짓수는 그리 많진 않았지만 모두 다 맛이 있어서 맛있게 배불리 먹을 수 있었습니다^^ 불편하거나 나쁜 기억 하나없이 편안하고 쉼을 온전히 누릴 수 있었던 디아넥스 호텔. 나중에 제주에 올 때, 또다시 오고 싶은 곳입니다^^"
2016.03.03,-,-,처음에 우연한 검색으로 디아넥스를 찾게 되었습니다. 이제는 제주 오게 되면 디아넥스 호텔을 1순위로 검색하고 예약합니다. (요즘 예약이 많아 일찍해야 한다는 실픔이...ㅠ) 조용하고 아늑하고 그리고 사우나까지... 너무 마음에 드는 호텔이라 여기에서만 쉬어도 너무 좋은것 같습니다. 진짜 추천하는 호텔입니다!!!!!! (너무 많은 사람들이 알아 버릴까 걱정인 1인입니다~ ^^ 나만 알고 싶은 호텔 )
2016.03.04,-,-,"작년에 포도호텔에서 묵은 후 디아넥스 오픈 소식을 듣고 무척 궁금했는데 갑자기 떠난 제주여행에서 하루밤 묵게 되었습니다 호젓하고 한가롭고 여유롭고 깨끗하여 제게는 더할나위없이 좋은 선택이었습니다 맑은 날 멀리 내려다보이는 산방산과 수평선, 해질무렵 수영장과 노천탕이 환상입니다 조용히 휴식을 취하고 싶은 분께 강추합니다"
2016.03.04,-,-,조식 맛도 괜찮았고.. 방도 깨끗하고.. 마음에 들었습니다~ 산속에 있는 느낌이라 밤중에 운전하기 조금 무섭기는 했지만.. 조용하고 직원분들도 친절하신 편이었어요~
2016.03.05,-,-,"객실과 호텔 부대시설 전반적으로 모던하고 깔끔함이 드러나는 곳이었습니다. 테라스에서 바라보이는 오션뷰와 산속에서만 느낄 수 있는 신선한 공기덕분에 매일 아침과 저녁으로 refresh할 수 있었습니다. 조식은 간단하지만 즐기기에 적당하였고 아침을 먹는 라운지의 경치는 평온함을 더해주는 곳이었습니다. 호텔 내 레스토랑 대신 비오토피아에서 식사를 하였는데 이 역시 너무 만족스러운 저녁이었습니다(식사와 경치, 분위기, 서비스 모두 엄지 척!!) 조금 아쉬운 점은 객실에 욕조는 없다는 것이지만 알고 예약을 했던 사항이고, 대신 여유로이 온천을 이용할 수 있어서 충분한 휴식을 누릴 수 있었습니다. 또한 설명 하나하나, 서비스 하나하나 배려가 넘치고 친절하신 직원분들 덕분에 호텔에 머무는 동안 더 편안할 수 있었네요. 조용한 휴식과 여유를 만끽할 수 있었언 디아넥스 호텔~휴가를 즐거이 보낼수 있게 해주어 감사합니다!"
2016.03.08,-,-,주변의 본태박물관과 방주교회 수풍석미술관 등을 방문하고 싶어 선택한 호텔인데 아름답고 직원들도 친절하고 객실도 좋았습니다. 온천도 특이했고 조식도 푸짐하진 않아도 깔끔합니다.
2016.03.10,-,-,"저번주 제주도 여행을 다녀왔는데요. 숙소가 너무 깔끔하고 시설도 좋았어요. ^^ 미니 바에는 과자와 음료수 물 등등 있었구요. 청소도 너무 청결하게 잘 해주셨더라구요. 신기한건 화장실 바닥에 물기가 하나도 없이 방바닥처럼 보송하게 청소가 되어있다는 점이에요. 아침 조식도 베이컨, 소세지, 죽 또는 국, 빵 ( 여러가지 잼과 크림), 시리얼, 감귤주스, 우유, 젓갈, 과일 등 등 나와서 맛있게 먹었네요. 창 밖으로 바다와 산방산이 보여서 너무 좋았구요. 시설도 최신이라 불편함이 없었습니다. 난방도 잘 되구요. ^^ 사우나도 했는데 좋더라구요. 6일 여행중 2일을 투숙했는데 제일 좋았습니다. 가족 단위로 많이 와서 분위기도 너무 좋았어요. 적극 추천합니다. ㅎㅎ"
2016.03.10,-,-,하루는 성산쪽에서 이틀은 여기 호텔에서 지냈는데 너무 좋았어요^^ 아기가있어서 범퍼침대를 부탁드렸었는데 미리 셋팅까지 해주시고 편히 지내다 왔네용 날씨가 흐려서 도착하자마자 수영장으로 내려갔어요 수영장 시설 깔끔하고 좋아요 노천탕도 있구요 아기전용풀은 물 온도도 따뜻하니 아이가 너무 좋아했어요 아기때문에 스파는 못가봤는데 다녀온 남편이 너무 좋았다고 3일내내 다녀왔어요 ..ㅋㅋㅋ 조식도 깔끔하니 딱 먹을만한것들만 차려져있고 시간도 넉넉해서 여유롭게 즐길수 있었어요 무엇보다 직원분들이 너무 친절하셔서 좋았어요~^^ 밖에 산책로도 이쁘게 꾸며져 있었는데 비도오고 날씨가 너무 추워져서 못가봐서 아쉬워요 (비가오는바람에 사진이...ㅠㅜ) 제주도 날씨가 워낙 변덕이 심해서 저처럼 아기도 있고 숙소내에서 즐길거리가 있었으면 더 좋겠다 싶으신 분들은 강추입니다^^ 괜히 평이 좋은게 아니였어요 아기가 있어 숙소잡기 여간힘든게 아니였는데 이번엔 성공적이였던거 같아요 다음에 제주도가게되면 또 이용하고 싶은 숙소였습니다
2016.03.11,-,-,디아넥스 호텔 너무 감동이예요 신혼여행와서 2박 투숙했는데 객실 분위기며 깔끔함이며 조용하고 모던한 아주 훌륭한 객실에서 투숙하였어요 조식도 심플하고 아주 좋아요 ^^ 너무 좋아서 지인 추천해주려구요~~~ 가성비 갑 디아넥스 !! 앞으로 여기로 자주 투숙하려구요!!
2016.03.12,-,-,"가격, 룸 컨디션, 조식, 사우나 주변 모든것까지 모두 만족스러웠어요 :) 늦은 저녁 체크인해서 가는길이 넘 무서웠지만 (가로등이 없어서 ㅜㅜ) 편히 쉬다 왔네요. 다음에 또 이용할게요 ㅎㅎ"
2016.03.13,-,-,새로 오픈해서 너무 너무 깨끗했구요~ 일하시는 분들도 너무 친절하셨어요^^ 수영장이 너무 예뻣어요 전면이 통유리라~ 등산하고 돌아와서 온천도 했구요 피로가 싹풀리는 느낌이었어요^^ 다시 이용하고 싶은 마음 완전 완전 있습니다! 아 그리고 조식먹을때도 뷰가 너무 좋았어요~
2016.03.13,-,-,여러 숙소를 가봤지만 디아넥스는 단연 최고네요! 산 중간에 있어서 고요하고 좋습니다. 사우나도 좋고 조식도 나쁘지 않습니다!
2016.03.14,-,-,좋은곳이었어요~ 주변도 조용하고 깨끗하고...사우나도 쾌적했고 조식도 간단히 먹기 좋은 메뉴였어요~ 또 이용하고 싶네요~
2016.03.14,-,-,"자연과 호텔의 인공물이 잘 어울어진 공간에서 잘 쉬다 왔습니다! 비오는 주말동안 쉬다 왔는데, 날씨 맑을 때도 참 좋을 것 같습니다. 가까운 곳에 미술관도 있고, 새소리와 연못의 운치.. 넘넘 좋았는데, 한가지 옥의 티를 찾았습니다! 룸에 있는 전기 주전자 안에 곰팡이가 있었습니다.ㅜㅜ 좀 놀랐습니다..;; 보통 방 안에서 전기 주전자를 쓸 일이 많진 않지만, 작은 것 하나에도 좀 더 신경을 써 주시면 호텔의 만족도는 200%일 것 같습니다~!! 따뜻한 날 한번 더 놀러가고 싶습니다. 디아넥스~"
2016.03.15,-,-,산방산과 바다가 보이는 룸도 정말 맘에 들고 온천+수영장에서 힐링 제대로 하고 왔습니다~! 아라고나이트 온천수 정말 신기하네요
2016.03.16,-,-,포도호텔 옆에 새로 생긴 곳이라 해서서 밤 늦게 도착하는 첫날은 저렴한 이곳으로 집았는데데사우나도 수영장도도침구도 모두 만족스러웠어요요아기침대가 없었는데 대신 침구 그냥 주시면 좋았을걸. 그건 좀 아쉽더라구요 ^^
2016.03.16,-,-,첫 숙박이 인상깊어 또다시 예약 편안하고 힐링이 되었던 디아넥스 계속 찾고 싶은 호텔이네요. 만족스런 숙박이었어요 직원분들도 친절하시고 너무 좋아요
2016.03.18,-,-,아늑하고 산 속에 있어 가족과 함께 즐기기에 매우 좋았습니다 서비스도 좋고 조식도 만족했습니다! 다음에 또 방문하고 싶습니다
2016.03.21,-,-,제주에서 번잡스러운 곳을 벗어나 완전한 고요와 휴식을 만끽할 수 있었습니다. 수영장도 작지만 아주 잘 관리되고 있어서 좋았습니다.
2016.03.21,-,-,호텔 만족도 굉장히 높았습니다. 시설이나 친절도 모두 좋았습니다. 다만 네비에 잘 나오지 않아서 방문하실분은 본태박물관 치고 가시길 추천드립니다.
2016.03.21,-,-,조용해서 너무 좋았구요 특히 수영장과 사우나 시설이 깔끔해서 만족했습니다. 가격대비 조식까지 제공되어서 가성비 좋은 호텔입니다
2016.03.22,-,-,아침에 창밖의 풍경은 고요하고 신비로워 보였어요. 최고의 아고라 나이트 온천수는 정말 최고였습니다. 다음에는 부모님 모시고 재방문하고 싶은 호텔입니다. 친절한 직원분들도 인상적이네요.~^^
2016.03.22,-,-,5~6번 정도 다녀왔는데 갈 때마다 만족스럽네요. 다을 달부터 가격이 오르던데 너무 아쉽네요...앞으로 가기는 어려울 것 같네요 ㅎㅎ
2016.03.23,-,-,"위치는 본태박물관,포도호텔인근으로 조용한곳에 위치하고 있습니다. 룸컨디션은 넓고 깨끗하였습니다. 호텔내 사우나와 수영장도 이용가능합니다. 투숙객은 본태박물관 입장료 50%할인 가능하니 이용하시길 바랍니다. 미니바 무료이용도 작은 배려였지만 기분좋은 서비스였습니다."
2016.03.24,-,-,언제나 만족이지만 점점 가격이 오르는 걸 보니 가슴이 아프군요 ㅎㅎ 이젠 다른 숙소를 찾아야하나 ㅎㅎ 아무튼 머무르는데 불편함이 없는 훌륭한 호텔입니다.
2016.03.24,-,-,아이하나 부부 이용했는데 카펫이 아니어서 좋았네요 조식도 가짓수대비 먹을만 했구 쾌적하고 좋았어요
2016.03.24,-,-,신축 호텔이라 그런지 엄청 깨끗합니다 조식도 정갈하고요 미니바 무료라 잘 먹었어욤
2016.03.25,-,-,"깨끗하고 조용하고 깔끔하고 그랬어요 아기가 있어서 요구드린게 좀 있는데 한가지도 이루어진게 없었지만, 합리적인 가격에 묵은 것 같구요, 온천 기대했는데 입소문만큼 좋은지 못느끼겠더라구요 주변경관보며 새소리들으며 산책해서 좋았고 본태미술관 관람한게 기억에 남네요^^ 참고로 트윈은 싱글싱글입니다"
2016.03.26,-,-,적은 가격에 많은 걸 누리게 해 주는 호텔이에요. 전 두번 다 이 곳에서 잤는데. 대만족입니다. 특히 직원들이 너무 친절해요. 침구는 말할것도 없이 깨끗합니다
2016.03.27,-,-,디아넥스 호텔 깨끗하고 좋습니다. 진입로가 험하긴하지만 깨끗하고 조식도 맛있네요. 온천도 좋습니다.
2016.03.29,-,-,포도호텔 세컨브랜드라고 하여 일단 믿고 가봤내요 비롯 체크인은 칼같이3시 넘어서 해주셨지만 객실도깨끗하고 조용하고 좋았습니다다시간관계상 사우나와 수영장을 이용못하고 온게 아쉽네요요 미니바도 공짜고 조식도 너무기대만 안하면 걍걍 괜찮았어요
2016.03.30,-,-,"부족함 없이 잘 쉬다 왔습니다. 중산간에 있어 주변에 아무것도 없는 점이 단점이자 장점으로 생각되었어요. 예약한 범퍼침대 상태도 매우 좋았고, 가습기는 당일 예약이 마감되어 이튿날에 받을 수 있었어요. 조식은 가짓수가 많진 않았지만 알찬 구성이라 만족하며 먹었습니다. 아이가 먹을 죽과 국이 있어 좋았구요. 포도호텔도 그랬지만 작은 규모의 호텔이라 더 아늑한 느낌이 들고 부담이 덜했네요."
2016.03.31,-,-,"예전에 이용했던 호텔이라 시설이나 위치면에서 훌륭합니다. 첫 1박을 자는 숙소로 정해 중문관광단지와 차로 15분 거리라 식사하기도 좋으며, 특히 이곳의 온천욕은 최고입니다. 온천과 힐링을 원한다면 최고의 선택이라 생각합니다. 내비게이션에 디아넥스로는 검색이 안될 때가 있어 본태박물관을 입력하면 쉽게 찾아갈수있습니다."
2016.03.31,-,-,별 기대안하고 갔는데 가격대비 매우 좋은곳이에요 프론트 분들도 너무너무친절하셨구요 객실이랑 부대시설도 전체적으로 다 깔끔해서 기분좋은 여행이었어요 호텔 시설뿐만아니라 분위기나 서비스도 군더더기없이 딱 좋아요 주변에 본태박물관이랑 방주교회도 가깝고 관광단지랑 떨어져있어서 조용하고 산방산도 보여서 휴식을 취하기 좋은 위치에요 호텔내 레스토랑이 따로 없지만 비오토피아 레스토랑까지 매우 가까워서 그냥걸어서 갈수도 있고요 조식뷔페도 부담없이 만족스러웠습니다 온천물도 좋아 피로 풀기에도 좋았어요 다음번에도 제주도 가게되면 재방문하려구요
2016.04.01,-,-,조용하고 괜찮습니다. 온천도 괜찮구요. 골프장클럽하우스안의 고급스러운사우나 분위기에 수영장도 아기자기하게 있네요. 산속에 떨어져있어서 시내하고는 거리가 좀 있는편이구요. 아침조식은 시간이 11시까지로 여유롭네요. 간단하게 먹을수 있는게 준비되어있구요. 조용하게 쉬기에 좋은 호텔입니다.
2016.04.02,-,-,룸컨디션 좋고 직원들도 친절합니다..호텔 위치가 산속이고 주변이 한적하여 조용히 쉬고 싶으신 분들에게 추천합니다.
2016.04.02,-,-,"부모님 친구분들 예약해드렸는데 만족해하셨습니다. 온천물도 좋고, 깨끗하고.. 아침부터 맛집 찾을 필요없이 착한 가격에 조식포함이라 좋고, 미니바도 무료로 이용하여 좋다고 하셨습니다."
2016.04.03,-,-,good good good good good good good good good good good good
2016.04.03,-,-,깔끔하고 너무좋았어요ㅡ 깊숙히 위치하고있어서 밥먹고들어가야할거같아요 간식도 미리사두면좋을거같아요 온천물도좋고 지은지얼마안되서 깔끔ㅎ 조식도괜찮았어요 다음에 또가고싶네요
2016.04.04,-,-,"일단 개장한지 얼마되지 않아 깔끔한 편입니다. 중산간 지역에 위치하고 있어 교통이 조금 불편한 편이기 하지만 가성비를 생각하면 정말 우수한 호텔이네요. 실내수영장이 깨끗하고 자연채광이 좋아서 만족스럽게 이용했습니다. 사우나도 맘에 들구요. 주변에 비오토피아, 방주교회, 이시돌목장이 있는데 중산간지역 구경하면서 상대적으로 저렴한 가격에 하루 정도 지내고 가실 계획인 분들에게 강력 추천합니다."
2016.04.05,-,-,한번 좋은 호텔로 인식되니 같은곳으로 호텔 예약하게 됍니다 ㅎㅎ 이번에도 아주 편안하게 투숙했네요
2016.04.06,-,-,일요일예약했더니 조식 사우나 수영장 모두 여유있게 기분좋게 이용했습니다. 룸이나 침구컨디션도 좋았구요 다음엔 꼭혼자 다시가보려구요
2016.04.10,-,-,조용하고 호젓한 곳에 위치해서 그런지 너무너무 좋았네요 친절 깔끔 가격까지 재방문의사 100프로!
2016.04.10,-,-,만족만족 ㅋㅋ 온천도 좋았고 조식도 나름 괜춘 방도 조용하고 굳굳 다음에 또 가고파요 ㅎㅎ
2016.04.10,-,-,전날 포도호텔에서 묵어서 그런지..; 호기심에 선택한 아넥스는 객실은 딱2인 기본이었어요 아직 새집냄새는 덜빠진듯했고.산방산이 멀리 내려다보이는 트인전망.맑은공기.조용해서 좋았어요.온천도 조용~ 조식은 젊은취향 기본인것 같고 조식때 연못 오리 자연경관이 마음을 평온하게~ 주변 본태박물관 50%할인혜택이 있었고 방주교회도 볼만~
2016.04.11,-,-,매우조용하고 온천이 좋습니다 산방산이 보이고 시설도 깨끗하고 좋습니다 온천이 만족스러웠음
2016.04.12,-,-,좋았습니다 좋았습니다좋았습니다좋았습니다좋았습니다좋았습니다좋았습니다좋았습니다좋았습니다좋았습니다좋았습니다좋았습니다좋았습니다좋았습니다좋았습니다좋았습니다
2016.04.12,-,-,"숙소가 정말 조용하고 넓고 깨끗합니다. 조식도 깔끔, 온천도 깔끔, 수영장도 ! 다 너무 마음에 들어서 다음날 묵은 휘닉스아일랜드가 너무 초라했습니다. 다음여행에는 전체일정 모두 디아넥스로 해야겠어요 정말 강추!"
2016.04.12,-,-,룸 컨디션이 무척 좋아서 아이와 즐겁게 보냈어요ㅇ 다만 근처에 아무것도 없어 미리 준비를 해와야 만족스런 스테이가 될것깉이요 뷰도 좋고 침구도 다 맘에들었어요ㅇ 일박은 짧고 이박이상 하면 좋을것같아요 ㅋㅋ
2016.04.12,-,-,넓고 수영장 좋고 위치 좋은 호텔입니다. 다만 다 개장을 안하고 일부만 열어놓고 큰 연회실이 있는데 그냥 놀리는 듯... 아직 프로모션도 크게 일부러 하지 않는 느낌이 드네요. 조용해서 좋네요.
2016.04.12,-,-,기대한만큼 참 좋았습니다^^ 디자인도 맘에 들고 정원도 좋고 딱 좋았네요 다음에 제주도 가도 또 묶을꺼에요
2016.04.13,-,-,산 중턱에 있어 어두울 때는 찾아가기 좀 힘들 듯 합니다. 운전이 익숙치 않은 길이라~ 하지만 아침에 일어나서는 조용하고 한적한게 참 좋았습니다 온천도 너무 좋았구요~ 일찍가니 전세낸 듯 하더군요 수영장은 아침 9시부터 오픈합니다~ 수영도 산속에서 하는 기분이 들어서 쵝오 하지만 조식은 좀 부실한 느낌이에요~
2016.04.15,-,-,"포도호텔 대신 선택한 호텔이라,, 어느정도 기대가 있었는데 늘 그렇듯 기대만큼 실망스런 부분도 있었지요.. 와인패키지로 갔는데,,와인잔 준비가 안 되어있으니까 그냥 들고가란다!! 휴~ 샤워하고 나오니까 현관까지 물이 흥건하고 호텔쪽에 얘기하니 그저 죄송하다고만 하더군요.. 그래도 수영장이랑 사우나는 그나마 관리가 잘 되고 있더군요.. 거의 거기서 지내다시피 했습니다~"
2016.04.15,-,-,수영장 조식 룸컨디션 모두 평균이상입니다 개인차가 있겠지만 저렴한 비용에 욕심이 많지 않은 한 만족하실거에요~^^ 편안하게 1박하고 왔네요~~ 아기가 좋아해서 수영장 유아풀에서 한참 놀다가 사우나가서 피로도 풀고 다음날 맛난 조식도 먹고 즐거웠네요
2016.04.18,-,-,"호텔안 시설은 전반적으로 깔끔하니 괜찮았습니다 다만 아쉬웠던 점은 호텔 창문 커튼에 검은 무엇인가각 묻어 있었습니다. 좀 오래동안 있었던거 같았는데 세탁이 안되어 있었네요 샤워실에 욕조는 없어서 좀 불편하지만 워닥 요새 이런게 대세라 대신 1층 로비에 목욕탕이 있습니다. 온천수가 나오는 목욕탕인데 이용객이 별로 없어서 그런지 괜찮았습니다. 조식은 그냥 몇개 없는데 대충 때운다는 느낌이지만 주변에 워낙 먹을 곳이 몇군데 없는지라 조식을 먹고 이동하는게 좋습니다. 그게 아니라면 비오토피아, 포도호텔 레스토랑을 추천합니다."
2016.04.18,-,-,"위치가 시내와 떨어져 있어서 조용히 잘 쉬다 왔습니다~주말이용했으나 이용객이 많지 않았는지 무척 조용했구요 아이 동행했는데 아이데리고 온 가족단위 손님이 대부분인듯 했습니다 수영장은 6세미만 무료라 수영장 전세낸듯 놀고 왔습니다^^ 다만 5세부터는 조식 이용시 금액발생하는데 호텔 투숙객기준 12,000원이었고 음식 내용에 비해서는 다소 비싼느낌이었습니다. 룸 상태도 깔끔하고 크기도 적당했습니다. 다만 에어컨은 조작을 잘 못한건지 작동이 안되어 사용을 포기했습니다.프론터에 물어볼만큼 덥진 않아서요^^; 참고로 프론터 분들은 무척 친절했습니다. 냉장고 크기가 큰편은 아니라 큰사이즈 사이다 같은건 냉장고에 안들어가서 못 넣었어요 대신 콜라.쥬스 등 몇 가지 음료.과자 미니바 무료로 이용할수 있었습니다. 중문.서귀포 시내/서부권 해안까지는 자동차로 약 30~40분 걸리는 거리이고 공항까지는 막히지 않았을때 약 40~50분 걸리는 거리에 위치해있습니다. 제주도는 밤에 안개가 자주끼는데 산속에 위치한터라 밤 늦게 이용할때는 안개때문에 호텔찾아오기가 무척 힘들었습니다.(날씨가 흐린날이었습니다). 전체적으로는 관광지 바삐 돌아다니지 않고 조용히 자연구경하며 지내기에는 좋은 숙소였던것 같습니다^^"
2016.04.18,-,-,아기랑 3박4일 일정이었는데 역시 실망시키지 않았네요 범퍼침대 에어워셔도 챙겨줘서 넘 잘 사용했어요 다음에 제주가면 또 이용할래요
2016.04.20,-,-,호텔 3시경 도착하여 체크인 후 수영장으로 바로 내려가 사람도 별로 없고 소독약 냄새도 안나서 좋았어요 샤워실 사우나 편의시설은 좋아요 방주교회 본테박물관이 가깝고 룸에서 보는 풍경은 좋아요 직원 분들도 친절하고요. 단점 절대 돈 주고 조식은 드시지 마세요 이제까지 다녀본 비지니스급 호텔 중 최악 대명 한화 심지여 일성콘도 보다도 못해요 룸컨디션은 침대매트나 미니바 서비스는 좋아요 단지 스낵은 싸구려지만 그래도 챙겨 주는 서비스로 고객감동 청소 상태는 먼지가 서랍 손잡이 마다 그대로 방치 화장실 머리카락 변기에서의 냄새 주차장이 멀어요 발릿해주면 좋을 텐데 걸어 가지 못 할 정도는 아닌데 좀 귀찮다 정도 호텔 유지비 차원 인원 감축으로 인하여 미비하다고 생각 되는 그런 곳이였어요
