reviews,scores
"서울에 있는 모든 주요 호텔 (신라, 파크 하얏트, 그랜드 하얏트, 웨스틴 조선 호텔, 콘래드, 있습니다) 이 한 four seasons 의 최신 버전인 무리. 방은 생각보다 넓고 다른 사항 파크 하얏트, 최고였습니다. 환상적인 시설과 완벽한 서비스. 모두가 안내, 하우스 키핑, 프런트 데스크는 매우 친절하고 환상적인 바텐더. 절대적으로 환상적인 위치에 있는 경우 만 고려할 수 있는 휴가 여행을 처음 계획은 서울의 주요 관광지 (광화문 인사동, 명동, 동대문, 등). 그러나 이곳은 꽤 많은 강남 지역에서 멀리 떨어져 있을 시간 잘 수 있는 다른 사람들 입니다. 전체적으로, 환상적인 곳 입니다.",5
"저는 서울에서 2 주 동안 이 호텔에 묵는 비즈니스. 방은 크고, 시설도 많고, 서비스도 최고 이며! 솔직히, 가끔 서비스도 너무 좋은 - - 저는 한 사람의 수는 수만 남아 :) 그리고 누군가가 항상 질문 을 어떻게 수 있습니다! 어서, 정말, 좋은. 장점 - 편안한 침대, 블라인드, 서비스, 수영장 / 피트니스 센터 단점 - 근처의 소음이 광화문 (해당 호텔의 문제이지만 짜증이 나는 경우는 바쁜 시간 과 같은) 아침 식사는 비싼 편이고 반복 (이 이미 포함되어 있지 않습니다 특별하지 않은 돈을 내 - - 품질에 비해 비싸지) 놓치지 마세요 - 스파! 다시, 저는 추가 비용을 지불하기 가지 특별한 스파 (가격 에 포함되는, 이후에 포함되어 있지만 마음에 들어요! 고 스크럽 (모르는 경우 한국식 스크럽과 정보. 적극 추천하는) 및 편안한 온수 욕조 빈. 또한, 지하에 비밀의 바 (계단 아래 숨겨집니다) - 지불하는 "" 특별 "" 이, 하는 것 같은 느낌을 사용하고 스픽이지!",5
"서비스 & 직원들도 좋았고, 친절한 & 친절한. 객실은 아주 깨끗하고 현대적인 &. 편의 시설은 굉장 했습니다. 3일 밤을 보내고 떠나야 할 수 없다! 다음에 서울에 다시 올 것을 나는!",5
디럭스 실에서 3일 밤을 이곳에. 빨간색 에 도착했는데 - 내 방은 이미 준비를 비행 할 수 있는 이른 체크인 - 에서 - 엄청난 칭찬을 fs 팀. 룸 - 매우 새 건물이어서 방 안에 불평할 것. 사소한 문제 하나는 외부의 소음 정도 때문에 공사 / 길가 이 정도 거리에서 들을 수 있었다. 서비스 - 나는 안경을 착용하고 나에게 묻지 않고 남아 있는 와이프 데스크 서비스 팀이 전혀 예상치 못한 사려 깊고 할 수 있습니다. 이 호텔에서 아주 좋은 영어를 할 수 있을 지 저를 마지막 순간에 예약을. 이 호텔 또한 2 km 반경 내 무료 차량 서비스 가 매우 도움이 되었다. F & 수 - 저는 조식 (아주 좋은 선택 및 charles h. (바 컨셉의 컴파일 시대) - 사람들에게 강력히 추천하는 곳 입니다. 이 호텔이 좋은 호텔이지만 제가 본 파일 시스템은 표준 및 선호하는 파일 시스템에 신라 서울 신라 호텔 가격 대비 뛰어난 시설만 더.,5
"야 yaun 호텔의 레스토랑도 좋지 않았어요, 이 에는 어느 정도 (michellen 1 star, 비싼 음식은 아주 좋지 않습니다. 호텔은 아주 좋은, 아주 좋은 휘트니스 클럽, 적합한 교육 였습니다.",4
"저는 출장으로 서울에서, 이 호텔이 있어서 새 choosed 및 비즈니스 지역 - 산책을 하기 때문에 걱정하지 않아도 교통 정보. 놀라운 호텔, 서비스, 방. 을 수 있는 것이 저의 까다로운 사람들이 장애, 아니지만 저렴한 가격의 가치가 있는 - 이 호텔은 굉장히 좋은 일식 레스토랑 아침 식사는 거대한 선택. 스파는 하지 않는 호텔이 있는 곳에 수건이나 생수, 헬스 클럽 / 휘트니스 센터 유지할 수 있는 적절한 studio, 최고 수준의 장비도 깨끗하고 다시 들기, 물, 수건, 있습니다. 제가 노트북을 tv / 오디오 시스템 첨부할 프레젠테이션 준비, 2 4 분 후에 전화가 와서 정렬하여 본 사람들, 곧 문제가 없습니다. 강력히 추천 합니다. 하지만 이 호텔은 말 하지 않는 결점이 자주 좋음, 단 아침 식사는 가격이 생각 포함되어야 합니다.",5
호텔 위치는 훌륭한. 근처에 있는 많은 관광명소. 모든 직원들은 훌륭하고 매우 도움이 되었다. 전문 바리스타가 발견한 좋은 아침 식사 주문 시 또는 카푸치노 라떼. 매우 깨끗하고 훌륭한 시설. 저는 추천합니다,5
이 호텔을 강력 추천 한다; 방은 사랑스럽고 편안한 느낌이 동시에 신중하게 설계하고 가상적으로 무제한입니다. 뷔페식 아침 식사는 놀라운 고고학 유물을 기본 룸. 직원들은 매우 협조적이고 즉각적인 대응. 시내 지역 위치가 좋은 아주 쉽게 액세스할 수 있습니다.,5
"직원들은 친절하고 도움이 되었습니다. 제공되는 서비스에 문제가 없었다, 제 숙박이 무료 스트레스. 편리한 위치 입니다. 휴식하는 동안 서울에서 즐거운 시간을 보냈고 이 곳으로. 날씨가 좋아서 아름다운 계절. 다음에 꼭 다시 머물",5
"우리는 이 곳에 다시 묵을 계획하고 있는 서울. 변경다른 선택하는! 좋은 위치, 현대적인 시설과 훌륭한 직원들. 특별한 감사의 andrew 클럽 라운지의 따뜻하 친절한 환영 해 주었다. 우리는 이 호텔에서 훌륭한 서비스 제공자 들을 효율적으로 감사합니다. 바쁜 하루를 마치고 돌아가 멋진 오아시스 서울 관광.",5
"절대적으로 아무것도 말할 수 있는 긍정적인 것이 있지만 포시즌 호텔 시설. 처음 도착했을 때 우리를 체크 아웃 정말 멋지 었어요. 일부 직원들은 이그제큐티브 클럽 이름을 기억할 수 것을 전하고 개인적으로 - 하지만 모든 사람들이 이용할 수 있다. (가치가 있을 수 있는 특전 이 추가로 작은 $, 000원). 아침 식사와 각종 음료를 가진 행복한 시간을 좋은 멋진 전망. 퍼플 라인인 #5 위치 덕분에 대해서. 포 시즌 서울을 잘 했어요. 감사합니다.",5
아주 아주 좋은 h 텔 professionnal 팀. 객실은 넓고 창문이 커서. 침대는 매우 편안했어요. 서울에 있는 아주 좋은 위치. 저는 수영장과 골프 연습 appr ciate 저는 추천 합니다.,5
"이곳에서 가족과 함께 2주 (7살 아이). 완벽한 숙박 - 호텔은 아름답고, 현대적인 감각 도 있었어요, 방은 모든 시설과 용품이 갖춰져 있어 편안한 침대와 베개, 등이 있습니다. 어댑터가 없으면 필요한 (모든 객실에는 국제적 전기 플러그). 방은 매우 조용한 (주말에 4월에 들린 상태 chants 광화문 광장의 시위대 에 거의 하루 동안만). 직원들은 매우 친절한, 항상 도와주지, 환영해 주는 것처럼 느껴지는 매일 매일 밤 집에 돌아온 후 관광을 하루 종일 돌아다니 더군요. 더 좋았던 점: - - 지하철 역 (광화문, 라인 5) 몇 발자국 떨어진 곳에 (내 변경다른 대괄호), 10 - 걸어서 1분) - - 여러 관광 명소에 걸어갈 수 있는 거리 - - 위치가 아주 좋았습니다 식료품점, 15 - 걸어서 15 명 동, 롯데 백화점 인사동, 등이 있습니다. - - 친절한 아이! (아이들이 ' 메뉴, 에 - 작은 발에 슬리퍼, 아이들이 ' 목욕 제품, 있습니다) - - 훌륭한 실내 풀장과 온수 욕조 설치 8층에 있는 전망, 저녁에 수영 하는 몇 가지",5
"내 시간이 절대적으로 좋은 시즌이 좋네. 방은 매우 편안하고 멋진 경치가. 빨리 나가는 깨끗한 침대와 좋은 창 열펌프와 상쾌한 샤워와 욕조가 있습니다. 정렬할 수 있는 좋은 경험이 된 그의 어려움, 체크 인 및 체크 아웃.",5
"저는 24시간. 이곳은 훌륭한 호텔입니다. 넓은 디럭스 룸은 매우 편안했고. 뛰어난 아침 식사는 선택의 폭이 넓게 스타일의 식사. 하지만 낮은 층에 있는 아침 식사 룸 (windows, 분위기가 아주 좋습니다. 너무 좋은 이탈리아 레스토랑 (점심에는 mcghie) 이 있다. 질적인 면을 주저함 없이. 하지만 가격 대비 품질.",5
"일주일 동안 출장. 꼭대기 층에 있는 방이 아름다웠고, 도시 경관이 아주 좋았어요. 서비스는 완벽하고. 최고의 부페 아침식사는 먹어 본 곳. 체육관 시설 - 가격. 브라보!",5
"Four seasons 호텔 내에서 시간, 서울은 정말 즐거움. 나는 할 수 없습니다 오류 단일 면 이다. 직원들은 최고입니다, 그들은 아주 친절하고 마지막 여행 예약 저녁 식사 예약 및 전송. 방에서 보는 풍경은 매우 잘 하는 곳이면 제가 어떤 것이 필요할 수 있습니다. 하우스 키핑 직원들은 방은 흠 하나 없고 또한 칭찬 할 때 제가 돌아오 았습니다. 호텔 내 음식은 좋았습니다. 저는 클럽 룸과 클럽 라운지에서 아침 식사를 매일 아침 때문에, 뷔페식 을 선택할 수 있는 동안 작은 편 이, 질은 화려한 경치가 멋진 라운지. 나는 망설임 없이 이 호텔을 추천 합니다.",5
"모든 것이 너무 좋고, 특별하지는 않다, 하지만 좋은. 늘 열정적이고 친절한 직원. 좋은 직원들, 근사한 호텔, 하지만 적 "" 와! "" 모든 것이 비싼 예상. 뿐이었어요. 쇼핑이나 구경하기 좋은 위치 이다. 전체적으로 평균적인 내 생각은 서울의 그 자체.",4
"최고 수준의 서비스와 넓은 방은 아주 좋고, 우리가 먹는 일본식 레스토랑, 비싸지만 가치가 있고. 한식 / 양식 / 품질 좋은 다양한 뷔페식 아침 식사가 많은 중국 음식",5
"매우 친절한 직원들이 필요한 아주 좋은 호텔. 저는 아주 멋진 스파 체험, 더 이상 이용할 수 있다. 호텔 내 레스토랑은 비싸게 다른 그룹. 여기 다시 묵지 않을 것임을.",5
멋진 호텔! 최고! 모든 것이 기대 이상인 호텔. 호텔에 들어서는 순간부터 내 체크 아웃. 이 호텔은 전문성 / 품질의 감동적인 친절함과 호텔 직원들의 훌륭한 호텔 이다. 오!,5
"제가 가장 좋아하는 도시 서울 이지만 서울 제 최근 여행 포시즌스 라 더욱 특별 합니다. Charles h. 모음은 매우 인상적 였다. 강력 추천하는 호텔은 손님들이 체크 아웃합니다. 포 시즌 호텔과 비교했을 때, 이곳은 가격 대비 가치가 절대적 가치 입니다.",5
"서울은 매우 비싸고 좋은 호텔을 찾을 수 있도록 비즈니스 도시로 돈을 볼 수 있습니다. 포시즌스 호텔 없을 경우 제한 합니다. 너무 고급 호텔이 다. 제공된 서비스에, 방의 시설, 품질 업홀스터리를, 장엄 함에 방을 말한다. 레스토랑은 최고. 음식은 호화로운 스프레드를, 본격적인 연출",5
"시설 및 직원들의 서비스도 놀라운 인상적이다. 객실 조건에 수영장과 바 뿐만 아니라 1층 도 멋지고 빨리 다시 가고 싶습니다. 이 호텔은 모두 좋은 커플, 가족. 좋은 위치 - 지하철 역에서 매우 가깝고, 및 기타 관광명소",5
"집처럼 느껴지는 곳이기 때; 노스탤지아 나갈때 같은 분위기와 서비스에 보세요♪. 그것도 사계절 이 모두 제공, 출장 또는 개인 여행 시, 가족과 함께 또는 혼자 여행",5
"놀라운 호텔과 직원들이. 훌륭한 음식, 훌륭한 분위기. 그들은 매우 도움이 되었고 우리는 귀족처럼 대접. 우리는 급변하는 비즈니스로부터백업 및 이름을 기준으로 합니다. 놀라운 시간이 있었습니다. 정말 좋았다.",5
직원들이 그들의 자세를 만드는 실제 차이; 이 호텔은 훌륭한 위치에 있는 아름다운 현대적인 느낌 입니다. 커피숍 또는 신문 을 읽는 사람들과 멋진 곳.,5
Four seasons 에 묵었습니다 가격(12세) 의 딸과 함께 이른 봄 에 벚꽃 일본 벚꽃 길. 저는 서울에서 머물 곳을 오랜 시간 동안 열심히. 몇 가지 장소에 대한 생각 (매우) 에 있는 깊은 전통적인 한국식 분위기와 반얀트리 hiltons 더 크기 입니다. Four seasons 정말 아무것도 이길 수 있습니다. 우리는 4박을 센 가격. 우리는 높은 방 위에 시계와 도시의 거리 문화를 볼 수 있는 감동. 위치는 훌륭한 한 - 다. 걸어갈 수 있는 오래된 로얄 궁전. 아주 가깝지 않고 있는 레스토랑들과 외식을 하고 택시나 지하철을 타고 필요할 수도 있습니다. 호텔에서 식사는 품질이 매우 비싼 서울 기준. 우리는 특히 즐긴 여러 - 지하에 있는 요리 뷔페. 아마 가장 좋은 수영장과 온수 풀 자쿠치 꼭대기 층 이다. 이와 같은 훌륭한 시설이 떨어져 있는 관광 이다.,5
"아름다운 공용 공간과 좋은 방. 방은 아름답게 완료 완료 완료 창이 있고 화장실 변기에 따뜻한 전기. 표준 기능이 필요한 위치에 있는 4! 어떤 사람들은 나를 귀찮게 하지 않을 것이지만. 근처에 호텔이 위치한 지역은 생성하여 주 / 노이즈 그리는 이벤트. 이 명확하게 들리는 26층에 있는 방. 이 시티 호텔, 소음이 스테이징될 수 있습니다. 꼭 하고 싶고요!",5
"우리가 도착하기 2주 전에 호텔에 이메일의 멋진 컨시어지 서비스 계획 의 4 - 할 수 있는 걸지 사용자_이름:. 우리의 관심과 스타일이 완벽하게 전합니다 리 설계했습니다 일정 에 적합합니다. 늦은 밤에 도착했을 때, 우리는 아름다운 한 접시에 간단한 자필 메모를 전하고 과 함께 우리를 환영 할 수 있습니다. 사계절 이 있는 매우 따뜻한, 상냥하고 전문적인 직원. 나는 이 호텔을 떠날 때 꼭 안내 하지 않는, 실제로는 꼭 하는 것이 좋기 때문에 전합니다 가라! 26층에 있는 큰 방 였습니다. 절제된 인테리어도 세련되고, 할 수 있는 - 수 - 천장 창 및 자동화된 윈도우 커버링 계속 멋진 경치를 감상 한 개인 정보 보호 작업을 수행할 수 있습니다. 이 호텔은 중앙에 위치한, 해서 서울 쉬웠습니다. 매일 매일 우리는 영어 및 한국어 안내 대상 주소 카드 이 다 할 수 있는 택시 기사, 언어에 문제가 되지 않았습니다. 일본에 있는 꽃은, bergmann 디자이너 니콜라 로비 커피숍 - 꼭 가보세요! 또한, 꼭 스픽이지 밑에 화려한 답변하기. 우리는 바에 앉을 수 있는 전문적으로 만든 게 manhattens. 서울에 있는 큰 부분과 사랑에 빠지지 었다 때문에 four seasons 의 시설과 직원들. 자르기와 같은 아이스크림!",5
"저는 항상 여행 한국 음식 에 스파 그리고 비즈니스. 이 시기는 다른. 8개월 된 아기와 함께 여행을 했습니다. 2주 동안의 여행 중 하나 이었음이 도시 아시아 대륙, 다른 도시 4, 5 호텔. 서울에 있는 세 번째 정지 하는 것인지는 잘 모르는 일반적으로 오래된 four seasons 에서 서울 강남 대. 또한 이 거의 비즈니스 호텔 리뷰를 읽었는데. 도착했을 때, 직원들은 매우 친절하고 많은 포 시즌 호텔. 그 가 자신의 아들과 인사 자동으로 내 사랑 이 날 fs 불독! 우리가 예약한 룸이 있는 아들과 남편은 우리의 숙박을 비즈니스 작업 공간이 더 필요합니다. 방에 들어가자, 안에 침대 두 개가 각각 하나. 직원들은 신속하게 이동할 수 있는 다른 숙소를 가기 위해. 우리는 결국 한 범주 및 스위트 룸 보다 더 아름다운 풍경이 오래된 궁전. 그래서 나는 한국 드라마를 볼 수 있는 궁전 방문한 적이 이지만 전 알고 있었다. 객실은 넓고 아름다운 구식이다. 욕실은 아름다운 도시의 전망은. 저는 아기가 있다. 욕조와 냅킨 통 도 있어서 호텔을 한 적은 없어. 이 경우는 세 가지의 호텔 이 여행에서 우리가 묵었던. 저희는 전 세계 많은 호텔을 다니지 었다고 말하는 이 호텔이 최고의 시설. 이 놀라운 운동 시설이 있어서 실제 클럽. 한국 스타일의 스파도 있고! 스크럽과 사랑 의 경우, 있거든요. 저는 안타깝게도 제 경험을 한 사람이 있기 때문에 스크럽 마사지 하는 시터 다. 또한 이는 베이비시팅 서비스. 이는 2 주에 한 시간을 엄마가 있었는데. 이 놀라운 수 있는 시터! 내",5
"비지니스에 좋은 위치. 넓고, 편안한 객실과 훌륭한 서비스. 한가지 이상한 기능 - - 화장실 문을 열어 할 때는 열립니다. 바는 아주 좋고, 서비스가 될 수도 있지만 조금 더. 또한 사용 중인 "" 스픽이지 "" 개념을 느끼는 허세 한 호텔",5
포시즌스 호텔 서울에 머물렀던 최고의 호텔 중 하나 이다. 직원들은 필요한 편안한 휴식을 보장하고 나은. 방은 적당한. 매우 깨끗 합니다. 방에서 보는 전망이 정말 환상적이었어요. 저는 꼭 이 호텔에 머무를 때 서울.,5
"가장 놀라운 호텔, 좋은 위치, 하지만 한가지 모든 레스토랑 중 가장 서울. 직원들은 집에 있는 것처럼 느껴져 필요한 모든 것들을 만들 수 있다. 서울에 있는 더 이상 여행을 계획하고 보이지 않는 사계절을 둘 수 있습니다.",5
"품질, 서비스, 위치 및 탁월한 선택이 스테이징될 포 시즌 입니다. 가지 않을 수. 이 비싼 편이지만 특별한 가치를 받을 수 있다. 업계 표준 고급 호텔 four seasons 브랜드를 설정합니다. 내년에 다시 갈 계획.",5
"서울에서 먹어 본 중에 최고의 숙박을. 좋은 위치, 멋진 전망 객실에는 도시, 직원들은 매우 친절하고, 멋진 레스토랑은 현대적인 시설. 서울에 있는 호텔 중 최고의 호텔. 꼭 다시 갈 거에요. 건배 L",5
"저는 플래너 와 함께 일정 의 경우 모든 서울 레저 일주일 여행을 제공하는, 처음 온 사람들로. 아무것도 그리워 하지 않도록 하는 데는, 역시 그리워 하는 관광객들은 시간 낭비. 그래서 몇 개월 동안 미리. 한 번에 이메일 안내와 도희 (사랑하는). 그녀는 매우 친절하고 우리가 간 앞 뒤로 몇 번 오 목록, 매번 하여 추가 할인이 있는 완벽한 물건을 가지고 일정 카운티까지! 이 개월 전 그녀는 우리의 방문 은 정말 훌륭했습니다! 이 모임을 처음에 우리가 머무는 동안, 그녀는 모든 관광지와 식당 서지 예약을 한 것은 단지 배치를 해주려고 하고 했다. 서비스 포인트! 나 에 대해 다 말할 수 없는, 도희, 너무 감사합니다! 그래서 우리의 인상 할 것, 그리고 우리가 머무는 동안, 더 이상 호텔 입니다. 호텔과 방은 믿을 수 없는 실내 장식. 피트니스 센터는 시설이 보는 체육 시설 최고의 호텔! 이 거대한 도시의 풍경을 즐기면서 장비가 너무나 좋은 일하는 것. 우리가 묵었던 클럽 룸과 이그제큐티브 라운지도, 그곳에 간단한 간식과 와인을 돈으로 해 어울려 매일 한 두 시간. 모든 객실은 기본적으로 모든 것을 할 수 있는 원격 제어 및 화장실, 하면 이 앉아! 말 그대로, 변기 위에 화장실 문 열 때 자동으로 였다. 하하 호텔의 위치도 좋고, 몇 걸음만 가면 지하철이 있습니다. 몇 블록 가면 팰리스. 멋진 작은 레스토랑과 카페가 가까이에 있었습니다. 우리는 이 호텔에 다시 돌아갈 꿈도 꾸지.",5
"6일 동안 이 나 four seasons 에 서울은 최고였던 호텔 중에서 최고. 직원들은 놀랍도록 도움이 되어 더욱 멋진 숙박. 바쁜 일정에 업무 차 한, 이 호텔은 오는 좋은 방법이 쉬고. 멋진 장식, 훌륭한 피트니스 센터와 수영장 시설이 좋은 음식 메뉴도. 마지막 은 "" 숨겨진 바 "" 직접 검색해야 합니다. 있는. 저는 이곳에 다시 방문할 것.",5
"저는 9월에 부모님과 함께 서울에서 four seasons 에 지난 6일 밤을. 두 개의 이그제큐티브 룸을 예약했는데 클럽 라운지 이용. 호텔은 꽤 새 그곳에 묵는 인테리어 및 예술 작품에 감탄했습니다. 개인적으로, 이 호텔은 원본 예술품의 가장 큰 장점. 모든 현대적인 직업 들이 중간. 정말 멋진 작품들을 다른 섹터 수 만큼 호텔 에서 발견. 첫 번째 딸꾹질 은 우리의 첫 번째 만나는 아침에 우리는 아침 식사를 즐길 수 있을 같은 층에 클럽 라운지에서 제공하지 않는 것이 굉장히 제한되는 사계절. 가장 실망스러운 부분은 신선한 과일 제공: 대신에 다른 과일들이 다양한 것을 미리 작은 컵을 과일 샐러드 처럼 보였다. 대부분의 과일이나 제가 찾는 아침 식사에 행복하지 않다고. 제가 테이블 중 하나 또는 서버 내의 안내를 받아 저는 오렌지 주스와 커피 라운지 hostesses 호텔로 말 했습니다. 몇 분 만에 도착 할 것이 얼마나 잘못된 것입니다. 이전에 홍콩에서 묵었던 리츠 칼튼 호텔도 높은 수준이라는 밤 이 있는데 이것은 포시즌, 네 가지지 않습니다. 라운지에 갔을 때 주인이 그녀가 아는 것보다는 느낌이 나는 메인 레스토랑에서의 아침 식사가 아래층 이 필요 했습니다. 가격 였습니다. 제가 지불한 방법이 있는 라운지 이용이 더 낮은 음식. 일반적으로 클럽 라운지 이용 은 예약할 때 아침 식사는 특별한 호텔이 다, 라는 점. 별 5개 호텔 클럽 라운지는 모두 부탁 드립니다. 저는 정말 이 제가 하고 있는 수정. 마지막으로 우리는 아침 식사를 할 수 있는 놀라운 대신 메인 레스토랑.",4
"Four seasons 호텔에서 훌륭한 숙박시설 입니다. 방은 아름다웠고 아주 잘 - 디자인, 특히 사람 때문에. 방에는 유니버설 콘센트, 장치 내 작업이 매우 편리한 다. 조명도 좋았고 굉장히 … - 편안해. 전망이 좋고, 고급스러운 욕실, 침대는 아주 편안해요. 식당 음식은 균일 좋은 - 특히 아침 식사! 저는 이 호텔을 적극 추천 합니다.",5
"위치: 북부 지역 은 서울에서. 경복궁과 북촌 한옥마을 근처에 있는 등 많은 관광명소 시설: 새 시설. 수영장이, 스파, 피트니스 센터는 큰, 분리된 여성과 남성 들이 클럽, 골프 코스 및 실내. 호스팅 중 최고의 레스토랑이 합니다; "" 시장 "" 등은 국제적인 뷔페 식 아침 식사와 저녁 식사를 줌. 체크인: 부드럽게. 객실: 아름다운 도시의 전망, 넓은 객실과 욕실 로 고급스러운 및 에 있습니다. 나는 아기의 잠은 편안한 침대와, 부드러운 린넨, 더블 블라인드. 또한 커피와 티 스테이션. 컨시어지 서비스: 케빈 은 정말 도움이 되었습니다. 감사합니다. 인터넷: 무료 고속 인터넷에서 할 수 있는 시설. 집 유지: 관대 하다. 이 호텔을 강력 추천하는 서울 이다.",5
"이 호텔은 제가 묵었던 3월 2017 1 . 5살 정도였습니다. 현대적이고 고급스러운 느낌이 있는 사랑스런 로비 등 전체적인 분위기, 아침 식사 장소 엘리베이터, 복도, 방 자체는 물론. 3 세트 제 방에 유리창 전체 높이, 전체 저항 전기 블라인드와 함께. 거대한 침대, 큰 tv, 사랑스러운 욕실. 서비스도 훌륭했습니다. 직원들이 아주 빨리 안내에 따라 요청. 모든 직원들이 인사를 하고 기분 좋게 잘 지 - 교육. 객실은 환상적이었습니다 (도 한 게 내 양말, 전화 및 모든 컴퓨터 케이블/번들 이 다). 호텔 위치도 좋고, 근처에 내 작업, 여러 궁전도 있고, 주변에 현지 식당도. 내가 본 중 최고의 호텔 헬스 클럽, 체육관 및 수치 많은 전용으로 둔다. 거대한, 잘 갖추어져 있고, 친절한 직원들. 아침 식사도 훌륭했고, 유리 바닥을 통해 볼 수 있는 것들이 고대 유적. 1 주 동안 이곳에 머물렀는데, 이 호텔에 머물고 싶고 더 이상.",5
"훌륭한 서비스, 맛있는 음식과 숙박시설 - 강력 추천합니다 - 전 세계에 많은 시간을 보내고 있는 서울의 호텔 중 가장 좋은 경험해 본 4 계급. 사람들에게 필요한 휴식을 취하기에 장거리 비행, 수영장과 헬스장과 스파도 최고의 선택",5
절대적으로 멋진 호텔 입니다. 6일 밤을 묵었는데 2월 2017. 클럽 라운지는 패키지도 최고였어요. 라운지의 음식은 많은 다양한 세계. 방이 정말 괜찮았어요. 위치도 중심가에 걸어갈 수 있는 모든 것은 쇼핑 거리. 10 개의 별.,5
