reviews,scores
"우리는 7월에 휴가를 서울로 갔다. 우리는 웨스틴 호텔의 쇼핑 지역과 가까이, 제 75 살 엄마를 사랑하는 쇼핑! 이 선택해서 다행이다. 편리한 위치뿐 아니라, 웨스틴 운송 서비스 를 제공합니다. 호텔을 예약했는데 4일 차. 하지만 드라이버만 영어를 약간 알고 있었다, 그는 그의 의사 소통을 시도하기. 여행 계획을 변경해서 자동차가 있었는데. 긴급하지 않은 때문이다. 나는 호텔 여행 서비스로 전자 메일을 보낼 수 있습니다. 5분 정도의 시간. 응답하지 않을 수도 있고 이미 알고 있는 유일한 드라이버. 그래서 윤능한! 나는 나의 방에서 나온 콘택트 렌즈. 제가 공항에서 발견할 수 있다. 바로 전에 있는 웨스틴 호텔에 이메일을 하면, 그들은 제가 한 콘택트 렌즈 및 뿐 다시 나에게 소포 보내기번역, 무료로! 또, 입니다! 우리는 꼭 다시 방문할 때 웨스틴!",5
"이 호텔은 정말 대단합니다. 로비에 들어서는 순간부터 향기 씸리스 살짝 경험한 체크인, 완벽한 서울에서 보내는 휴식. 있는 내 특별한 요청 및 직원들이 가장 좋았어요. 나는 돈을 내고 무료로 클럽 레벨을 강력 추천합니다. 음식은 좋지만 서비스는 안에 있는 것처럼 고급 레스토랑. 사실, 우리가 보내는 6성급 호텔 경험! 서울 웨스틴 조선 호텔을 강력히 추천합니다.",5
"기존 웨스틴 - 훌륭한 서비스를 제공하고 잘 정돈되어 있었다. 이 호텔은 장점은 서울에서 가깝고 주요 관광지. 지 않는 거리에 위치하고, 원하는 모든 것을 볼 수 있는 빠른 드라이브 - 특히 주요 간선 도시 센터를 사용할 수.",4
"할 수 없을 만큼 웨스틴 조선 호텔을 추천합니다. 우리 방은 우리가 도착하기 전 예약 시 안내에 투어를 예약하는 동안 온라인으로 예약했는데 DMZ/JSA. (투어 입니다!). 그런 다음 새 한 현대적인, 한국 식당, 몇 개월 동안만 개방 하는 도사(인도식. 정말 추천! 저녁 식사도 추천하고 싶은 사람이 있는 것이 우리의 기대를 넘어 여행할 수 있습니다. 호텔에 도착해서, 우리는 우리의 방으로 바로 갈 수 있는 오전 7 이었음에도 불구하고, 체크인을 하기 전에. 방은 넓었고, 시설이 잘 갖춰져 예상해야 합니다. 짧은 낮잠을, 우리가 필요로 하고 있는 컨시어지 서비스를 제공하는 충고를 점심 식사 옵션 및 다른 좋은 지역 추천. 웨스틴 조선 서울에서 가장 오래된 호텔이라 모든 택시 기사가 알고 싶은 곳에 가서, 그는 우리에게 영어를 잘 해서 한국어도 하지 않았다. 서울 웨스틴 조선 호텔에 숙박하는 것이 다음에 입니다.",5
위치가 좋은 호텔 - 로얄 궁전과 일부에서 도보 거리에 있는 중심 업무 지구... 저도 좀 피곤하지만 여전히 허용. 식당은 가장 일반적인 - 아침 식사는 평균 수준이 - 가격 대비 꽤 실망...,3
"좋은 비즈니스 호텔이지만 서울 웨스틴 기대 luxirious 의 다른 아시아 westins, 실망하지 않을 것. 방은 매우 작았지만, 깨끗하고 욕실도 오래되었지만. 피트니스 센터는 시설이 정말 좋은, 가장 큰, 다양한 프로그램을 제공하는, 많은 런닝 머신 에 많은 장비. 클럽은 매우 좋은 레스토랑과, 맛좋은 음식. 아침 식사는 매우 실망 만. 지면 좋겠다 하는 아주 작은 수준이었습니다. 위치가 좋은 호텔을 찾을 수 없습니다. 바로 옆이 시청. 조심하세요 정말 expensice 나드 수 있습니다.",4
"이그제큐티브 디럭스 룸을 예약했는데 6 한 웨스틴 조선 호텔 이른 체크인. 저는 3살 아이들과 함께 여행하고 아래 12, 이그제큐티브 라운지에서 아침 식사를 하는 액세스가 거부됩니다. 우리는 아침 식사를 요청하면 아침식사(빵, ARIA). 재미있는 것은 이, 20,000원 추가 지불해야 하기 때문에 각 한 한 다양한 아침 식사 들이 제공하는 아리아 선택할 수 있습니다. 어쨌든, 이 14 명, 조정할 수 있길 과, 6명이 먹고 나머지 우리는 아리아 않고 해당 비용 및 이그제큐티브 라운지에서 먹는 아침 식사. 그래, 우린 할 수 없다고 주장하는 아기 침대 요청하여 더 크립스. 연결된 객실 및 추가 요금? 할 수 있는... 추가 요금이 부과 될 수 있다. 3일 후에, 우리는 부산 및 제주 여행, 2박을 다시 돌아왔다. 이 되면, 우리는 사람들이 많은 도움이 되었습니다 그리고 emma 카일, 내 생각엔 이 호텔을 완전히 변경 찰나 에, 다른 곳에서 아침 식사를 하는 찰나 에 불평하지 않는 더 이상 가족처럼 느껴집니다. 그들은 우리에게 최선을 연결된 객실, 그리고 가족의 아침 식사 아리아. 그래서 실제로 많은 프론트 데스크 직원이 전체의 차이. 위치는 완벽했고, 음식에 쉽게 7월 - 11 단지에 있다.",4
"완벽한 숙박. 또 다른 집, 한 주! 미국에서 중, 미국의 모든 삶을 위해! 매일 무료 생수병 에서, 거절 토피, 물론 헤븐리 베드, 그리고 미국 합쳐저셔! 서비스는 완벽한 영어를 만들어 모든 사람들이 편안한 느낌. 웨스틴 호텔의 직원들은 훌륭한 일을! 모든 면에서 별 5개!",5
"이 호텔은 시티 센터에 위치하여, 걸어가면 쇼핑가, 레스토랑이 있다. 이 세련된, 현대적이고 매우 잘 되어 있었습니다. 완벽한 영어를 구사하는 직원들은 매우 좋았어요. 와이파이는 공짜로. 방은 크고, 편안하고 매우 깨끗합니다. 피트니스 / 스파는 예술 및 비용에 포함되어 (한국에 있는 특이한), 라운지에는 멋진 타파스 선택을 할 수 있는 충분한 큰 비즈니스 미팅. 아침 식사는 정말 좋은 식당 등. 이곳은 제가 처음으로 숙박하지 않을 것입니다 오.",5
"웨스틴 조선 호텔은 훌륭한 위치에 있는 여러 관광 명소에 쉽게 갈 수 있는 서비스입니다. 인천, 호텔을 통해 도달 한 사람당 $16,000 항공 버스 kwr. 자유롭게 편안하게 긴 여행 후 호텔을. 웨스틴 조선 호텔에 17th 층 executive deluxe room에 5박 6일을. 우리 방은 다시 롯데 호텔에서 아주 유명한 사람이 명동 거리를 시작. 방은 깨끗하고, 편안하고 넓은 한국 기준. 이 호텔은 항상 결원; 우리의 모든 질문에 잘 도와줍니다. 언제라도, 하고 싶어 하는 질문을 하지 않는 한 요청을 기다렸다. 사람을 볼 수 있는 직원이 신속하게 도움을 주었다. 안내해 준 저녁 식사와 모든 교통 수단을 사용하여 권장 사항을 우리가 여행지. 제가 하는 비지니스 호텔이라고 할 것입니다. 우리는 이 곳에서 한 번 느낄 수 있는 휴가를 따라 옷을 입고 작은 곳이지만 우리의 모든 기대를 만날 수 있는 숙박시설.",4
"웨스틴 에 묵을 수 있는 아주 좋은 비즈니스 서울. 직원들은 매우 능숙하고 협조적이었지만 별도, 위치가 좋은 음식 (호텔 레스토랑과 아침 식사) 등, 다양한 서비스가 큰 장점: 스파, 사우나, 수영장이 있습니다. 지내기 좋은 곳!",5
"제가 서울에 여행 내내 westin에서 지낼 계획. 호텔은 아주 편리한 위치 및 편의 시설 모두 액세스할 수 있습니다. 모든 스타우드 호텔, 편안한 침대, 객실은 깨끗하고 직원들은 매우 친절한 호텔. 한마디 더 하자 친절한 호텔. 나는 토요일 저녁 클럽 라운지가 7살 딸과 함께 해 주었습니다. 빈 라운지는 문 닫을 시간이었지만, 우리는 내 딸이 최소 연령은 아래 항목은 액세스가 거부됩니다. 저는 그 흔적 속에서 평화로운 숙박 기간 동안 잡으실려면.",4
"이 호텔은 좋은 위치가 특히 서울에 방문한다면 아마 1st 시간. 60 - 70 분 정도 걸리는 곳에 공항에서 리무진 버스를 타고 내리는 한국 항공사를 이용하여 호텔 앞에 한 사람당 가격은 16,000원. Spg 회원이라면, 적극 추천하기 로 선출된 라운지를 사용할 수 있는 아침식사, 오후 차 서비스, 그리고 저녁 전채. 또한, 액세스할 수 있는 사우나 (38,000원 번씩 할 수 있는 지불해야 한다). 모든 직원들은 매우 친절하고 도움이 되었습니다. 무선 인터넷은 무료 사우나도 매우 편안했어요. 로션과 샴푸는 엘레미스 를 이용한 이상, 미용 제품에 있는 브랜드. 서지 도시 축제같은 경복궁, 인사동, 명동, 남대문, 그리고 몇 가지 더, 아주 가까운 3,000 5,000원 또는 택시를 따라 걸어갈 수 있는 트래픽. 지하철 역은 너무 쉽게, 그냥 카드 같은 편의점에서 구입할 수 있는 공간도 너무 쉽게 여행하는 주민들. 애플리케이션들은 그들은 수 표시 방법에 대한 하나의 변경다른 정거자 역. 롯데 백화점이 호텔 바로 뒤에 한 번( 에 입구를 이용한) 말 그대로 지나쳐 롯데 백화점, 명동 쇼핑 거리가 보이는 저녁에 한국 음식 표시됩니다. 가장 가까운 역은 을지로 1( 입구 로비에서 사용)을 통해 그들의 정원이 이 길을 걸어서 지하철 입구 오른쪽 볼 수 있습니다. 1인당 여행 비용이 약 1,250 원이 있다. 한국에 있는 동안, 안가서 얼굴과 얼굴을 하고 있는 그들의 얼굴 synergy shangpree 을 추천하며, 이 것은 매우 감사 서비스를 받을 수 있습니다. 어디 에나있다",5
"여기에 머물면서 매우 실망했습니다. 웨스틴 호텔에 묵었는데 몇 가지, 하지만 이 최악이었다. 평균 수준. 룸 서비스 메뉴 가격은 슬펐습니다. 최소. 수영장은 그냥 어슬렁 어슬렁 거니는 거의 항상 바쁜 아이들과 함께 또는 성인 3 차선 용리시. 수영장이 있는 경우 자극적 이지만 옆의 길을 많이 할 수 있는 다른 사람들이 제대로 전체를 허용하지 않습니다. 할 수 있는 추가 요금에 사우나도 집에 손님. 저는 spg 회원, 에 이 말도 안되는. 직원들은 모두 친절하고 서비스가 좋은 이유의 3성급.",3
"이곳에서 6일 밤을 - 훌륭한 서비스, 멋진 아침 식사는 정말, 이렇게 가까운 곳에 위치하고 있다. 그냥 절대적으로 모든 것 을 즐길 웨스틴 조선 호텔. 서비스가 훌륭했습니다 - 모든 직원들은 전혀 문제 없 었구요 - 알려 준 넘어 갔다",5
나는 서울에서 묵을 웨스틴. 이 아름다운 호텔 - 잠깐 동안 이지만 오랫동안 유지하고. 우수한 서비스 및 섬세한 서비스. 시설 좋은 v v. 앞으로 서울에서 경쟁할 수 있는 온라인. 웨스틴 호텔이 리노 베이션도 데 필요한 사항을 - 서울에 있는 포 시즌 호텔은 오픈한지.,4
저는 이곳에 4일 동안 비즈니스 호텔은 친절한 직원들. 객실은 표준 크기지만 경관이 아주 좋았어요. 하지만 위치는 화이트 좋습니다. 비즈니스 지역 근처에 있는 쇼핑하기 - Myeoungdong. 객실 내 조명은 침대 옆 전자식 조절 패널 및 인상적인 매우 편리합니다.,5
"저는 몇 가지 일을 하고 편안한 느낌을 극다적인. 매우 깨끗하고, 친절한 직원들도 좋은 라운지. 몇 백 미터 가 많은 쇼핑몰이 유명한 쇼핑몰과 도로가 있었습니다. 주변에 맛있는 식당들이 많고 한국식 불고기 를 시도한다. 저는 다음 여행에서 꼭 다시 묵을 웨스틴 호텔.",5
"이 호텔은 절대적으로 좋은 높은 수준. 방은 아주 조용하고, 편안하고 매우 깨끗합니다. 직원들은 너무나 프로페셔널하고 정중하다. 명동 쇼핑 지역 근처에 있는 좋은 곳에 도시를 탐험할 수 있는.",4
"내가 찾는 서울에서 머물 호텔입니다. 이러한 가치, 고급스러움을 수 없는 위치이다. 방은 깨끗한 - 전형적인 시설은 매우 깨끗하고 웨스틴. 이 호텔은 주위에 보이지 않는 동안 control 등과 같은 패널 및 90s 에서. 저는 아이폰 스피커와 공공 조금. 전체적으로 서비스도 훌륭했습니다. 한 명의 프런트 데스크 / 컨시어지 정말 기대 이상으로 인식의 상태 및 도시 주변을 내었다. 클럽 라운지 직원들도 좋은 - 매우 따뜻하고 친절했습니다. 이 호텔의 하이라이트 중 하나는 헬스클럽과 수영장. 이 호텔은 아시아에서 아주 작은 체육관, 풀 서비스 헬스 미국에 많은 편이고 것과 같습니다. 밀어 랙에서, 많은 시스템, 무료 웨이트 트레이닝 기구, 요가 룸, 피트니스 룸 을모니터링 - 한 것! 아주 좋은 위치 이나 - 근처에 맛집 관광지 및 배치할 수 있습니다. 바/클럽이 가깝지 않긴 했지만 매우 빠른, 저렴한 택시를 타고 이태원 강남. 저는 spg 운이 있는 사람은 나는 웨스틴 중심에 위치. 레저 또는 비즈니스 여행객 모든 강력 추천합니다!",5
"웨스틴 조선 호텔은 비즈니스 클래스 호텔의 중심에 있는 환상적인 명동, 쇼핑지역에 위치하여 두 역을, (1) eujiro 시티 홀와 - 조지아는 액세스가 매우 의미. 필요한 경우 인천 공항에 가는 리무진 버스 서비스가 있는 호텔 바로 앞에서 정차합니다. 객실은 널찍하고 손님이 말하고 있는 것을 spg spg 층 - 근사한 방에서 한 쿠키 느낌이 들 어. 것은 운동을 하는 사람. 피트니스 센터는 24시간 관리할 수 있는 실용적이고, 이 시간 내의. 그들은 적당한 크기의 수영장도 아주 훌륭하지요. 인터넷 연결도 훌륭했고 방 자체 커피머신도 있다. 레스토랑과 룸 서비스는 비싼 편이었지만, 이번 서울에 있게 하는 명동의 식당들 보다 더 좋은 약 10분 떨어져 있고 (또는 거리 음식). 스타벅스가 있는 그대로 현관 바로 앞에 호텔이 있습니다! 좋은 호텔이었지만 만약 고급스러운 원하는 곳에 머물고 싶은 레저 여행객의 선물, 고려할 곳입니다!",5
"절대적으로 좋은 호텔이었습니다. 직원들은 너무나 프로페셔널하고 정중하다. 적어도 약간의 영어를 가장 많이, 아닙니다 아주 유창한, 참 좋았습니다. 호텔 자체는 아주 좋고 바로 옆에 위치한 명동. 호텔 뒤쪽에 있는 출구로 나와, 걸어서 5분 정도이고 명동 쇼핑 지역. 객실은 편안하고 좋은, 물론 매우 깨끗합니다. 최고의 가격 대비 성능. 우리는 약 일주일 머물 것이다.",5
"중앙에 위치한, 아주 깨끗하고 편안했어요. 웨스틴 알이 굵고 신뢰할 수 있지. 택시를 타고 또는 도보로 한 타워, 현지 식당과 흥미로운 재래 시장. 하지 않는 음식을 먹... 엄청나게 비싼 식당, 그리고 빵 가격이에요! 공항에서, #4 문을 종료하고 셔틀 버스, 기차를 타고 거의 한시간 에 $16 이다. 최고의 선택!",5
4일 밤을 보낸 웨스틴 조선 호텔을 주로 한 도시의 중앙에 있는 휴가. 위치는 아주 편리한 호텔을 찾고 있기에 서울 시내 주요 명소에서 도보 거리 내에 있는. 방의 품질 및 직원들의 서비스 수준은 기대를 통해 (객실 요금 기준). 킹 사이즈 침대가 있는 특실 을 예약했는데 깨끗하고 조용한 12th. 방에서 와이파이를 무료로 이용 할 일 없이 지속적으로 이곳에 머무르는 동안 문제가 발생할 수 있습니다. 이그제큐티브 라운지에서 아침 식사를 하는 것과는 다르게 이 가격대에서 그냥 평범한 호텔 -- 품질 면에서 선택 -- 추천하지 않을 이유가 아니다. 참고하였습니다. 쳇발 호텔 옆에 있는데 현재 공사 진행하는 소리를 식별할 수 있는 본 적이 없는 건설현장 인부들이 방에 있는 것을.,4
"직원이 로비에 짐을 모두 지원할 수 있는 경우 항상 정보 및 도움말. 그들은 내가 뛰어난 경험을 했고. 좋은 방, 목욕 수건은 얇고 작은 크기. 필요한 업데이트할 수 있습니다. 안내 데스크의 직원은 아주 도움이 되는 책 들 중 여러 일들이 귀하의 요청은. 완벽한 위치가 바로 길 건너편에 있어서 쇼핑을 할 수 있는 길거리 음식을 할 수 있었어요. 행복한 우리는 이 호텔을 선택하고 시내를 이동하기도 하고",4
"웨스틴 조선 호텔은 서울의 비즈니스와 쇼핑 센터에 위치해 있고, 여기서 대사관, 은행, 및 정부 기관도 나와 있습니다. 이곳은 롯데 몰이 걸어서 금방 갈 수 있는 명동 거리. 저는 제가 이 블로그에 회사 능률급 여행 중 2박을 관찰 해서 내에. 체크인 호텔에 도착하는 인천 공항에서 리무진 버스 (s $16 / 인). 도쿄에서 촬영을 했기 때문에 일찍 출발하는 비행기. 호텔에 도착하니 8am. 우리는 체크인을 기다리는 허용되지 않는 그룹에 대한 기본에 1,000 명. 그래서 많은 의견이 없습니다. 하지만 대부분의 사람들이 우리가 해 준 이 호텔에 우리의 짐을, 였는데 아주 잘 갔다 평가: 10/10 객실: 저희는 5th 층 디럭스 룸 twin bed (룸 515) 와 마주보고 있는 롯데 호텔. 방은 적당한 크기에 대한 32 평. 이곳은 32"" lcd tv, 2인용 소파와 책상은 적당한 크기의 창문. 웨스틴 침대 매트리스는 최근의 어느 부분이 정말 최고인, 부드럽고 푹신한 베개. 방의 조명으로 봤을 때,나는 어두운 것같은 그곳에 입찰 중입니다 아래 층에서 고층 건물 맞은 편입니다. 그들은 희망을 하나 더 넣을 수 있은 근처에 있는 tbi 침석. 욕조도 있고 화장실 크기는 일반적으로 함께 샤워실. 웨스틴 amentities 역시 일반적인 세면 도구들이 있습니다. 전반적으로, 방은 매우 편안하고 넓었습니다. 평가: 9.5/10 서비스와 시설: 아리아 레스토랑: 저는 메인 카페에서 아침 식사를 할 수 있는 기회가 해당. 지난 2 일에, 아침 식사를 하게 하는 웨스틴 호텔이다. 저는",5
"방금 한 웨스틴 조선 호텔에서 2일 밤을 보내고 8 - 2016년 6월 10일. 킹 사이즈 침대와 싱글 침대가 있는 방을 예약하고 2 설명 없이. 늦은 체크 아웃은 요청이 거부되었습니다. 긴 비행 후에 체크인을 했을 때 23:30 였습니다. 수신 전화가 와서 기다려야 했지만 전혀 부반송. 프런트에 가서 요청 킹사이즈 침대가 있는 방을 받았습니다. 나는 머리를 가지고 있었는데 가장 늦은 체크 아웃할 수 있기 때문이다 아리마를 곳이지만 나에게 첫 번째로 그들은 매우 불편하고 지저분한 나 때문에 정말 신경을 별로 하지 않는 말을 모두. 이제 중복 résistance 더 pièce! 내 공포, 문을 열었을 때, 다른 사람의 가방 안에 있었다! 확인하지 않는 한? 그래서 다시 프런트로 가서 다시 수정 카운티까지 해서 다음에 서투른 솜씨. 이번에 업그레이드를 요청, 제가 있어, 늦게 체크 아웃 및 무료 아침 식사. 스위트 (rm 720) 에 대한 불만은 없습니다. 크기의 이 객실은 2로 거실과 좋은 큰 욕실과 드레스룸, 그러나, 부적절한 부서 및 직원들은 예약을 명확하게 프론트는 – 적인 휴식의 인색함 같은 것들은 늦은 체크아웃을 하지 온나비 호텔 (이후 나는 꼭 두 번 방 두 개). 롯데 면세점 주차장을 볼 수 있는 720. 이에 중국 관광객들 버스가 스트리밍 중단 없이 전체를 참조하십시오. 직원들은 이곳에 머물고 싶지 않기 때문에 손님들의 마음의 – 적인 관심을 갖지 않는다. 저는 메시지 로부터 전화를 하루에 2nd 당직 매니저. 했을 때 그는 다시 1am 저녁 식사 후 다시 나는",1
"이 호텔을 사랑하는 최고의 위치, 깨끗한 방인 이그제큐티브 스위트, 식사 시간을 사용할 수 있는 제도가 있어서, 또는 무료 칵테일 시간. 욕실은 매우 넓고 좋았습니다. 이 호텔은 명동 시장도 있고, 롯데 백화점이 호텔 바로 옆에 있는 명품 브랜드는 기본적으로 다른 곳으로 이동이 필요하지 않고 모든 것이 도보 거리에 있다. 그러나 여기에 마사지 하는 것을 최고의 고급스러운 다른 호텔에 비해 아주 작은 그대로. 체육 시설은 제가 본 가장 큰 짐이 있는 매우 큰 기구들이 많은 한 곳입니다. 직원들은 친절하고 매우 도움이 되었습니다. 꽤 많은 사람들이 영어를 이해하고 있어서 더 편하게! 만약 이 호텔에 꼭 다시 올 것이 오",5
"位置方便 ， 應有盡有 ， 是購物 、 休閒 、 娛樂 、 飲食的好去處 。 房間乾淨整潔 ， 房間內的免費咖啡貼心 。 有保暖紙杯 ， 方便帶 。 美麗雪景令人難忘 ！ 명동에 위치해 있는 웨스틴 호텔, 가장 편리한 장소에 위치합니다. 수많은 레스토랑, 카페, 상점과 쇼핑몰 근처의 설득. 야시장이 가까이 걸어갈 수 있는 거리에 있습니다. 택시를 타고 동대문 에서 15분 내에 있다. 쇼핑하기 아주 편리했습니다. 방 안에 시설은 깨끗하고 좋았습니다. 그는 커피 머신에서 나온 커피도 훌륭했습니다. 이 호텔은 절대적으로 아름다운 눈의 풍경, 너무 사랑해요! 저는 친구들과 멋진 시간을 보냈어요! 작은 것 하나, 호텔 직원들은 도움이 되기를 거부하는 온라인/전화를 통해 주문 해 준 후라이드 치킨 을 가지고 자신을 위해 로비에. 우리가 한국어를 못하기 때문에, 우리는 우리의 질문에 한국인 동료 통해 주문합니다. 내 친구는 그녀의 다른 호텔을 가기 전에 이 같은 서울. 나는 이해할 수 있는 호텔이기 때문에 불평하는 것을 볼 수 이 거부할 수 있습니다. 그러나, 작은 이 9셀 같은 것을 좀 더 할 수 있는 경우 고객 만족 호텔입니다.",4
"매우 편리한 여행 - 바로 옆에 지하철 입구. 확인한 라운지, 무료 음료 (술 포함)를 위한 행복한 시간은 스낵, 조식 뷔페 및 라운지도 좋습니다. 아래층에 있는 뷔페에서 아침 식사를 하는 것이 보다 더 특별한, 동일한 선택을 하는. 방들은 모두 유사한, 과 그럴듯한 전망도 좋고 넓은 좌석과 편의 시설.",5
"제 남편과 저는 서울 웨스틴 조선 호텔에 방문하는 동안 선택한 4월. 할 수 있는 더 없이 행복한 시간입니다. 위치도 아주 좋았습니다, 친절하고 공손한 직원들, 인테리어, 편안한 침대, 에어컨 및 조용한 조용한 방. 우리가 선택한 방에서 묵을 수 있는 한 액세스 및 이그제큐티브 클럽 라운지 다행이다. 이 돈의 가치가 있다. 아침 식사와 저녁 식사 ""과자"" // 와인 가격에 포함된 방은, 공항에서 교통편뿐만 아니라 하나의 방법이 스테이징될 수 있습니다. 우리는 공항에서 픽업 서비스를 선택, 터미널 및 호텔 체크인을 한 인사를 하고 공항에서 친절한 직원들. 음식은 훌륭한 동서양의 스타일. 할 수 있는 멋진 빵집 아래 수준, 세탁 시설은 실내 수영장 및 액세스 및. 우리는 이 멋진 호텔에서 즐거운 숙박을 할 수 있는 서울에서 다른 여행객들이 추천합니다.",5
"이 호텔은 인상적이었다. 직원들은 매우 친절하고, 조식은 아주 훌륭한 호텔 로비는 꿈! 서울엔 많은 좋은 사람들. 좋은 경험이었습니다! 불행하게도 두 가지가 아래 합들: 1) 제가 사용한 방(541 어서) 아닙니다 내 기대 충족할 수 있습니다. 카펫 얼룩이 크게 두가지. 여행자들이 자주 나는 실망이었습니다. 나는 낮은 세계의 많은 호텔에서 별을 보지 못한 것이. 2) 빵집이 그렇게 좋지 않아요. 제가 구입한 초콜릿 케이크 마지막 날 마닐라에 위치한 다음 중지를 잘 아는 생일 파티. 오히려 실망하게 하고 매우 건조했습니다. 더 잘 할 수 있. 반복 했는데: 전체적으로 좋은 경험이 많은 긍정적인 점을 서울에 돌아갈 때.",4
전기 방에 문제가 생겼는데 첫날 밤에 신속하게 보았다. 피트니스 센터는 시설이 잘 갖춰져 있었고 흥미로운 입구. 전체적으로 훌륭한 숙박이었다. 아래층에 있는 빵집에서 아침 식사 하기에 좋았고 실행할 수 있습니다.,4
"웨스틴 호텔에서 하룻밤을 보냈다. 기능적인, 조용한 방. 콘센트와 사용할 수 있는 좋은 비즈니스 여행. 신속한 룸 서비스. 아침 식사 레스토랑도 훌륭했습니다. 일을 잘 하는 자동차 트인구멍 호텔 - 드라이버를 적절한 시기에, 똑똑하고 친절했습니다. 솔리드 값",4
"이곳에 묵는 세 번째 시간, 정말 같습니다. 좋은 위치, 쇼핑 및 기타 myengdong 근처, 인천 공항 kal 리무진 6701 합니다. 수영장 및 이그제큐티브 라운지는 환상적이었다. 나는 아직 시도해 사우나, 또는 레스토랑.",5
좋은 비즈니스 호텔. 시내 중심에 위치. 아주 좋은 스파와 피트니스 짐 착체. 웨스틴 이그제큐티브 호텔 전반적으로 좋은 품질. 객실은 조금 단순하지만 할 일을. 친절한 직원들. 아침 식사도 괜찮습니다. 위치가 좋은 백화점이 나 시장.,4
