reviews,scores
"남자친구 생일 기념 방문했는데 남자친구가 너무 좋아해서 만족스러웠습니다. 턴다운 서비스 너무 좋았고요! 아쉬운점은 미니컵케익이 미리 준비되지 않았다거나 이름이 제 이름으로 된 점, 팰리스뷰 업그레이드 금액을 잘못 안내받은 점은 좀 아쉬움으로 남습니다. 그래도 나머지가 너무 만족스러워서 다시 방문하고 싶고, 강력 추천드려요!",5
"1. 위치 : 시위를 많이 하는 장소에 위치하고 있어 시위가 있는 날에는 접근성이 좋지 않습니다. 가까운 랜드마크를 방문하시기에는 좋은 위치입니다. 2. 뷰 : 추가금을 지불하고 경복궁이 보이는 팰리스 뷰를 선택하시는 것이 좋습니다. 삶의 질이 높아지며 현재는 한화 55,000원이 추가되는 것으로 판단됩니다. 3. 서비스 및 직원 응대 : 균일하고 친절하며 전문성이 뛰어납니다. 투숙과 관련된 모든 내용을 상세하게 설명을 들을 수 있었습니다. 4. 시설 : 객실 정비는 잘 되어 있고 로비나 전체적인 호텔은 생각보다 규모가 큰 편은 아니나 실용적인 느낌을 받았습니다. 5. 가격 : 룸 레이트는 평일 한정 프로모션으로 크레딧을 받는 것으로 하면 과하지 않다고 생각되며 평소에는 조금 부담이 될 수 있을 것 같았습니다. 6. 전체적으로 좋았던 호텔입니다.",5
"우선 지금까지 여러 호텔을 가보았지만, 포시즌스는 정말 최고에요, 특히 아이랑 숙박시 많은 짐들과 어려움이 있지만, 포시즌스에서 제공하는 키즈 서비스는 정말 감동 이었습니다.",5
룸의 퀄리티도 좋고 직원분들의 응대 및 마인드가 좋았음 재방문의사 있다. 가격이 높지만 퀄리티에 비해서 높다고 생각은 들지 않는다,5
"시설및 청결도가 매우우수하며 직원들이 매우친절. 더마켓키친은 생각보다 별로얐으나 전반적으로 너무 좋았음. 침구, 시설 매우좋음",5
코로나 시대에 국내호텔 호캉스를 자주 가는데 포시즌스는 체크인 여직원 때문에 좀 황당했던 것 빼고는 호텔답게 지내다가 올 수 있었습니다. 몇 번이고 또 갈 의향 있습니다.,5
"체크인 과정에서 짐운반 등 세심한 서비스 와 더불어, 객실내 사진촬영을 권해주셔서 즐겁게 시작한 숙박이었습니다. 제공되는 물품이나 음식들도 모두 만족스러웠습니다. 침구도 최근 경험해본 것들 중에 가장 편안했었습니다.",5
가까운곳으로 휴가를 오기위해 선택한 곳 친절 한 서비스와 편안한 침구 및 시설이 올때마다 만족스럽고 위치도 매우 훌륭함,5
"상당히 오랜만에 방문했지만 여전히 깔끔한 룸컨디션이 인상적입니다. 별도의 로열티 프로그램이 없기 때문에 온전히 포시즌스에 묵고싶다 는 마음이 생겨야 방문을 하게되는듯 합니다. 로비, 발렛파킹, 룸서비스, 하우스키핑, F&B 모두 수준급의 서비스를 보여줍니다. 멤버십등급이 있는 다른 호텔 체인 보다도 더 큰 만족도를 느낄수 있는 부분입니다. 서울도심에서 가격대비 최상의 만족도를 느낄수 있었습니다",5
포시즌호텔을 첫 방문하였습니다 어린 아기와 와이프랑 투숙을 했는데요 유모차도 있고해서 지상에 주차를하고 싶었는데 지상주차장이 없어서 너무 불편했습니다 객실 내 시설은 전반적으로 깨끗 했습니다.,2
다른곳 돌고돌아 결국은 가장 자주 찾게되는곳입니다 기본객실은 거의 대부분 객실이 뷰가 답답하지만 청소상태나 서비스는 특별히 빠지는것 없이 마음이 듭니다,5
"직원분들이 항상먼저다가와 물어봐주고 또 제가 궁금해하는부분에 있어 동행해주며 설명해주었습니다. 객실 컨디션도 정말좋았고, 기분좋은 휴가를 보내고왔습니다",5
"호캉스로 홀로 여행했는데, 침구류도 좋고 태블릿피씨로 바로 주문할 수 있는 시스템도 넘 맘에 들었습니다. 편안한 하루를 보냈어요",5
"포시즌은 바로 회사앞이여서 왠지 선뜻 가겠다는 생각이 안들었었는데, 마침 24시간 스테이 프로모션이 있어서 방문했어요. 이미 정평이 나 있는 것처럼 직원들 너무 친절하시고, 룸컨디션도 정말 좋았어요. 기본 프리미어 룸이였는데, 지금까지 묵었봤던 5성급 호텔들과 비교해도 단연 탑입니다.",5
24hr 투숙으로 서둘러 체크아웃 하지 않아도 되어 좋았습니다. 모든것이 만족스러운 스테이였고 제가 젤 좋아하는 종로쪽을 다니며 숙박할 수 있어서 특히 좋았습니다. 직원분들 부담스럽지 않게 친절하고 방도 넓고 청소 상태도 좋네요. 조만간 엄마랑 또 방문할거에요.,5
"나의 호캉스는 늘 포시즌에서, 포시즌은 늘 옮다! 무더위와 코로나가 기승하는 여름에도 포시즌과 함께! 얼른 휘트니스 멤버쉽까지 가입할 수 있는 능력을 향해서 이번에도 편안한 힐링하고 가며 또 열심히 주어진일에 최선을 다하고 지내려고 합니다. 포시즌은 사랑입니다:)",5
자녀와 함께 세번째 방문이였는데 너무 좋았어요!! 이번엔 룸업그레이드도 하게되어 최고로 만족했습니다! 키즈텐트 이용했는데 아이들이 너무너무 좋아했어요!! 적극추천이에요!!,5
"시설과 서비스는 단연 최고라고 생각합니다. 다만, 비싼게 부담되니 프로모션때를 잘 노리면 좋은 가격에 즐거운 시간을 보낼 수 있는 것 같아요",5
포시즌스 한 달 살기가 버킷입니다ㅠㅠㅠㅠ 친절하고 다정하지만 수준 높은 직원분들의 접객도 너무 좋고 국내 5성급 호텔 중 침구는 최고가 아닐까 싶어요!,5
"시설은 물론 좋았고요, 직원들 친절함에 너무 편안했습니다. 동반한 아이들을 위한 작은 배려도 감동이었고요. 앞으로 자주 이용할 것 같습니다.",5
프론트에 윌리엄 호텔리어가 너무 친절하고 프로페셔널하게 응대해주셔서 첫인상이 굉장히 좋았습니다. 틀에박힌 응대가 아닌 고객과 진심으로 소통하는 느낌을 주셔서 포시즌에 걸맞는 멋있는 호텔리어셨습니다. 또한 객실 상태와 유유안 음식맛과 사우나 시설등 모든 부분이 훌륭해서 조만간 재 방문 예정입니다. 감사합니다.,5
"포시즌스는 어느 로케이션에 상관없이 머물렀을때 감탄하게 되네요 지역별 특성을 잘 살려 놓고 ... 서울은 서울 나름대로 리조트 성격은 아니지만 안정감이 느껴집니다. 서비스 , 침구류 등이 특히 마음에 들어요",5
"룸 크기, 룸 컨디션, 조식, 실내 수영장 모두 만족스러웠습니다. 위치 자체가 도심(시내)에 위치해 있어 편리했으며, 호텔 안에서만 지내기에도 부족한 시간이었습니다. 전반적인 서비스도 좋으며, 조식도 맛있었습니다. 실내수영장은 생각보다 넓지는 않고, 어린 아이들과 함께 가족 단위로 많이 오시지만 아이들과 즐거운 시간을 보내기에는 괜찮았습니다. 다만 저희 아이가 이제는 커서 그런지 키즈라운지에 대한 기대가 컸던 만큼 실망이...너무 좁고 미취학 아동들만 가서 놀기 적당하고 초등학생 이상은 오히려 실내수영장을 더 재미있어 하네요~ 하지만 좋은 추억 만들었고, 다음에도 또 다시 갈 예정입니다.^^",5
호텔숙박을 정말 좋아하는 사람인데 포시즌스는 너무 도심에 있다보니 서울에 거주하는 사람으로서 가보고 싶은 마음이 잘 들지 않았었습니다 그런데 이번에 숙박하고나서 제 마음속 1위호텔이 되었네요 인테리어도 사진으로 보는것보다 훨씬 고급스럽고 서비스 만족도 역시 최상입니다 !,5
"객실 종류: Deluxe Room 투숙 기간동안 호텔에서만 지내거나 광화문 지역에 명확한 목적이 있을 경우에 추천할 만한 깊이 있는 서비스의 호텔이다. 체크아웃 할 때 화장실 바깥쪽 문틀 손잡이 높이에 가느다란 철심 2개가 나란히 1cm 정도 튀어 나와있든 걸 직원분께 알려드렸는데, 이때 직원 분의 대응이 인상적이었다. 먼저 나를 걱정해주고, 책임을 지고, 어떻게 조치할 지까지 차분하게 얘기해주었다. 이래서 ‘포시즌’이구나 싶었다. 그나저나, 그 철심은 왜 거기에 그렇게 튀어나와 있었던 걸까? 객실 수선과정에서 남은 흔적이라면 다른 객실들도 한번은 꼼꼼히 검사해볼 필요가 있을 것 같다. 객실의 크기를 생각하면 가성비도 낮지 않다. 모든 공간이 충분히 넓다. 위치는 서울이 익숙한 사람에게는 그리 장점이 아니다. 주변에 있는 관공서와 오피스 빌딩들을 고려할 때 비지니스 목적의 출장자들에게 추천할 만하다. 호텔 옆에 식당들은 좀 있으나 호불호가 갈리는 경우가 많고, 주로 직장인들 대상 매장들이라 그 식당들을 투숙할 때 고려하기에는 좀 애매하다. 인사동, 효자동, 삼청동은 근처에 있지만 가깝다고 하기엔 조금 거리가 있다. 대중 교통은 의심의 여지없이 좋다. 객실의 인테리어는 시각적으론 상당히 만족스럽다. 처음 방의 문을 열고 들어왔을 때 그 느낌은 다른 호텔에서 느껴보지 못한 만족감이었다. ""와, 여기가 포시즌이구나"" 싶은 감탄이 절로 나오는 첫 인상이었다. 전체적으로 부드러운 색감에 짙은 금속 재질 프레임을 적절히 사용해서 차분하지만 지루하지 않게 잘 디자인되었다.",3
"포시즌스호텔서울에 너무 큰 기대를 했었나요? 좋은 점도 많았지만 체크인과 체크아웃 경험, 룸 청결 상태는 매우 불쾌했음을 밝힙니다. 체크인때 저를 맡아주셨던 직원은 처음 보는 고객에게 왜 그런지 모르겠으나, 얼굴에 웃음이나 미소, 친절 등이 느껴지지 않았습니다. 고객을 대하는 언행이 녹음기 틀듯 기계 같았습니다. 환대의 마인드가 부족해 보였습니다. 시티뷰를 선호한다는 말을 남기지도 않았는데 남겨져 있다고 원하지도 않은 시티뷰를 받았습니다. 차를 가져왔는지 물어보지도 않고 차번호 등록도 안해주셨습니다. 체크아웃때도 같은 직원이었는데 여전히 친절이나 미소, 환대 등은 느껴지지 않았습니다. 심지어 신용카드 디파짓한 걸 취소해야하는데 실결제 금액을 취소하는 실수를 했습니다. 왜 그 직원이 그리 친절도가 떨어지고 실수를 여러번 했는지는 모르겠습니다. 고객과 처음 만나는데 무슨 안좋은 감정이라도 있어서일까요. 왜 그런지 모르겠습니다. 배정 받은 방으로 갔었는데, 룸 청결 상태가 너무 불결했습니다. 왜 그런지 모르겠으나 먼지가 룸에 날리더군요. 손으로 여러 번 만져도 계속 나오고 정말 이상했습니다. 원하지도 않은 시티뷰에 룸 안에는 큰 기둥이 있고 너무 이상한 구조의 방이었습니다. 제가 포시즌스호텔서울에 뭘 잘못한 게 있나요? 제가 호텔에 지급해야 할 돈을 지급하지 않았나요? 공짜 투숙을 했나요? 왜 저에게 이런 방을 주셨나요?",1
다좋은데 음식이 너무 맛없어요. 라운지음식은 전체적으로 리뉴얼이 필요해 보입니다. 그외에 호텔 컨디션 직원응대는 우리나라 원탑입니다,5
"호캉스의 모든 부분과 장점을 동시에 가지고 있습니다. 자체적인 행사를 통해 F&B credit을 제공하거나 스파 관련 프로그램을 제시하고 있으며, 다른 여행사를 통해 30시간 투숙도 진행되고 있습니다. 그 시간동안 뭐할까 생각될 수 있는데, 식사는 룸이나 최고의 레스토랑 등에서 크레딧으로 해결이 됩니다. 또한 만족스러운 스파와 사우나가 피곤을 풀어주고, 근처 청계천,경복궁이나 피트니스 센터에서 조깅이나 운동을 통해 건강도 챙길 수 있습니다. 솔직히 어느 호텔이든 부족한 것이 있을터인데, 포시즌스는 모든 것을 갖추었기에 매우 만족스럽습니다.",5
"호텔 홈페이지에서 웰니스 패키지를 이용했으며, 구성에 매우 만족했습니다. 직원이나 시설 모두 좋았고 호텔 조식 룸서비스또한 훌륭했습니다",5
모든 것이 만족스러운 스테이였습니다. 이그제큐티브 라운지를 이용했는데 직원 분 중 sunny님 덕분에 라운지 방문할 때마다 편안하게 이용할 수 있었어요. 칭송 레터 쓰려다 여기에 남깁니다. 국내 여러 호텔 클럽 라운지 많이 이용해봤는데 가장 기억에 남네요. 친절하고 세심한 서비스 감사합니다. 다만 호텔에 아쉬운건 손님수 대비 직원이 부족하단 느낌을 자주 느끼게 한 점입니다. 코로나나 다른 이유일 수도 있지만 국내 탑 호텔로서 직원 수에 있어 신라나 인터컨티넨탈과 비교가 되네요. 직원들은 쉴 틈 없이 뛰어다녔지만 서비스 공백이 있었어요. (그리고 룸에도 있던 작은 소파 테이블을 라운지에서도 사용하는건 아닌 것 같아요. 좁아서 라운지 조식 힘들더라구요.),5
광화문 위치한 포시즌스 호텔 서울 투숙하면서 많은 의미와 생각이 들어 멋진 경험을 만들어 주었던 장소 호텔 로비 입장부터 아웃때 까지 기분 좋게 투숙을 함,5
"주말에는 아이들을 위한 프로그램이 있어 즐겁게 활동할 수 있고, 객실내 필요 사항에 대해 호텔 자체 어플이나 다양한 메세지 프로그램으로 빠르게 처리할 수 있어 좋았습니다. 2월에 재오픈한 더마켓키친의 음식도 맛이 더욱 좋아져서 만족스럽게 이용하고 왔습니다.",5
"추가금 내고 코너 프리미어 룸으로 업글했습니다. 집에서는 작업이 잘 되지 않아서 방문했는데, 원래는 3박 일정이었으나 객실도 넓고 조용하고 깨끗해서 1박 더 있었어요. 주변에 맛집도 많아서 식사도 편하게 해결했습니다. 특히 패드로 필요한 객실 어메니티 오더할 수 있는 점이 정말 좋아요. 또 방문 할 계획입니다.",5
특히 침구가 명성에 걸맞게 편안했어요. 코로나 때문에 뷔페식이 아닌 메뉴로 나온 조식도 맛있었고. 중식당 유유안도 맛있고 분위기 있어요.,5
좋은 줄은 알지만 가격대도 그만큼 높은 넘사벽호텔이라 발길이 쉽게 닿지 않는 곳. 차로 도착하면 발렛서비스-체크인 수속 신속해서 좋다. 객실 구조 모던하고 개방감 있으며 전통공예품으로 장식되어 품격을 더한다. 욕실과 침실이 분리되어 있지만 욕조와 침실사이 벽이 없어 따뜻한 욕조에 몸을 풀면서 시내전경을 감상할 수 있어 멋졌다. 고급호텔이 내집보다 편안한 느낌이 들 때가 있다면 침대에 누울 땐데 포시즌은 딱 그랬다. 보칼리노에서 아내와 와인 곁들인 식사 기분좋게 하고 나오니 세이지클럽에서 케익과 와인을 들여놨다(좀 덜 먹고 덜 마시고 올걸). 매일 사는 곳이니 관광 나갈 것도 없고 온전히 호캉스 목적으로 편안하게 쉬었다. 코로나로 좋아하는 gym이나 다른 부대시설 이용 안했고 부탁할 일은 없었지만 직원들 모두 친절하다. 샤워수압이 좀 약한게 이 럭셔리호텔의 옥의 티라고 할까,5
"이전 투숙 땐 좋지 않은 경험이 있었지만, 이번 투숙은 평생 경험했던 어떠한 호텔 투숙 중에서도 인상 깊고 행복했습니다. 제가 바빠 가족들의 곁에서 가장의 역할을 하지 못할 때, 대신하여 직원 분들이 저의 역할을 대신하여 일정을 조율하고 배려해주셨습니다. 연말이라 어디에서 가족들과 시간을 보낼까 고민이실텐데, 포시즌에 문의하셔서 행복한 시간을 보내시길 바랍니다. 서비스는 당시에 어떤 직원 분을 만나냐에 따라 달라질 수 있습니다만, 제가 확실히 느낀 것은 포시즌스 직원들은 행복한 투숙을 위해 매번 피드백을 거치고 노력하고 있다는 점은 확실합니다. 이전에 투숙이 별로였거나 조금 불만이 있었다면, 실망치마시고 다시 한 번 투숙해보세요. 그 기대를 보답할 것이라 확신합니다. 자세한 감사한 인사는 고객조사란을 통해 남겼습니다. 총지배인님, 지난 번 댓글 주셔서 감사합니다. 그래서 믿고 방문했고, 말씀하신 바와 같이 행복하게 투숙하였습니다. 행복한 연말 되세요.",5
"코로나로 어수선한 분위기, 막혀버린 해외여행의 답답함을 풀고 싶었다 . 서울시내 한복판에 위치한 퍼시즌스호텔 27층에서 1박하고 여유롭고 품위있는 조식서비스까지 받고 나니 조금은 위로받은 느낌이다. 객실 컨디션, 27층에서 보이는 남산과 서울의 뷰, 어메니티 등 역시 퍼시즌스호텔이다. 지하1층에 자리잡은 식당은 조선시대 유물들이 보이도록 부분적으로 바닥이 투명유리로 되어있어 역사를 느끼게한다. 직원들의 세심한 서비스와 신선한 식재료로 만들어진 요리들이 다 입에 맞는다. 퍼시즌스호텔 좋은 호텔이다.",5
욕조에서 반신욕을 하며 큰 창밖을 통해 야경을 볼수있어서 좋았어요. 한국적이고 모던한 인테리어가 상당히 이색적이면서도 우리 것을 잘 지킨 것같아 보기좋았습니다. 룸 청결하고 침대 엄청 편합니다. 커플이 특별한 날에 프리미엄 디럭스 킹룸 이용하신다면 만족하실거에요.,5
"첫 방문, 클럽 라운지 체크인시 담당 스텝분의 친철한 미소와 안내에 감사했습니다. 더 감동스러웠던 것은 저희가 키즈라운지 운영시간을 잘못알아 제 아이가 키즈라운지 이용을 못하게 되어 슬퍼하고 있을때 저희 가족 모르게 키즈라운지 스텝분들과 상의해 키즈라운지 스텝분들이 저희를 직접 만나러 와주시게 도와주셨고, 아이를 위로해 주시고, 다음날 꼭 같이 놀자고 약속해 주시기까지 했습니다. 행복한 시간을 보낼 수 있도록 세심하게 살펴주시는 서비스에 진심으로 감동했었습니다. 두번째 방문시, 항상 저희 말에 귀 기울여 주시고 공감해 주셨고, 더 부족하거나 불편한 점이 없는지 체크해 주시는 모습에 감사했습니다. 포시즌스 서울의 세심한 배려와 진심어린 서비스는 어디에서도 경험해보지 못했습니다. 감사합니다.",5
주로 spg나 ihg를 이용하는데 아내의 요구로 포시즌에서 일박을 했다. 국내외 호캉스를 하고 그닥 만족스러운 기억이 없었는데 너무 만족스러워서 트립어드바이저를 다시 설치하고 후기를 남긴다. 일단 7살 우리 딸이 자기 이름의 저 텐트에서 안나온다. 수영장 물 온도도 아이가 놀기 이상적이고 물안경 수영모 패들 모두 무료대여 가능하다. 나같은 가족 단위 방문객에게 이런 디테일한 서비스가 아주 만족스럽다. 재방문 의사 있다. 조식도 훌륭하고 직원들 모두 친절하다. 호텔 위치며 뷰까지 모든것이 완벽했다. 고맙다. 애도 좋아하지만 특히 아내가 매우 좋아한다.,5
"진짜 서울을 느끼고 싶다면 광화문으로 가라는 얘기 들어보셨나요 광화문에 가장 우아하고 품격있는 호텔, 포시즌이 있습니다. 이 곳에 머무는 동안 내내 행복했습니다.",5
결혼기념일로 투숙했는데 운이 좋게 펠리스뷰로 추가 차지를 더 내고 룸업글을 했습니다. 룸업글한 비용이 무색하지 않게 펠리스뷰가 너무도 아름다웠고 위치또한 경복궁 근처여서 가볼곳이 매우 많았습니다. 직원분들 역시 친절하셨고 라운지 음식들도 맛있었습니다. 실내 수영장도 매우 만족스러웠습니다.,5
"아직 이주일이나 더 남았다는게 막막할 정도 매일 자는 룸과 매일 아침 이용하는 수영장은 만족하는데 지하 바나 1층 라운지, 2층 보칼리노는 다시 가고 싶은 생각이 없음 (지하 바에 남긴 술도 어쩌나 싶음) 대부분 응대를 잘 해주시는 직원분들이나 한 두 분은 지금 내가 상전을 모시러 온 건가 의아할 정도로 짜증스럽게 응대하심 열개가 좋아봐야 한개로 물거품되는게 아쉽기도 함",2
"직원들과의 소통이 매우 잘되는 편이고 분위기가 매우 편안합니다. 아이와 매해 3년째 방문중이며, 아이도 무척 즐거워 합니다. 앞으로도 꾸준히 방문할 예정입니다.",5
"불편했던 점이 몇가지 있어 남깁니다. 첫째, 체크인 할때 대기줄 관리를 따로 하지 않아서 저보다 늦게 온 사람이 먼저 체크인 한 것. 둘째, 객실의 인터폰이 프론트 데스크로 연결이 되지 않아서 한참을 해멨습니다. 같이 비치된 태블릿으로 연결해달라고 요청하니 그제서야 작동 된 점. 셋째, 클럽 라운지 조식 식사중 접시가 몇개가 쌓이도록 치워주질 않아서 치워달라고 요구하니 그때부터야 중간중간 체크한 것. 체크인 할때 그렇게 큰 문제도 아니었고 인터폰 안되는 것도 답답하긴 했습니다. 조식 이용시 저희가 구석쪽 자리에 앉아서 확인하기 어려웠을것도 이해는 갑니다. 그러나 마지막 네번째로 체크아웃 하는 날 오전에 프론트에 전화해서 호텔 내 식당 예약을 부탁하였으나 이른시간이라 식당이 9시에 오픈 하면 예약가능한지 확인해서 연락을 준다는 말을 믿고 다시 잠들었는데 연락이 없더군요. 체크아웃이 12시인데 11시 30분에 일어났습니다. 다음은 말 할 것도 없죠. 어느 식당도 예약하지 못하고 이후 일정은 꼬일대로 꼬여서 최악이었습니다. 체크아웃 하면서 이 이야기를 하니 정말 죄송하다고 제가 어떻게 해드리면 되겠냐고 하는데 어떻게 해주면 되겠냐고 물어보기보단 어떤 조치를 취해줄 수 있다고 이야기 했으면 더 나은 대응이 되었을 것 같습니다. 그분이 직접적으로 잘못한것도 아니고 제가 뭐라고 하겠습니까. 호텔리어분들 모두 친절하긴 하였습니다만 서비스가 조금 부족한 점이 있으며 서비스에서 가장 기본적이고 중요한 것을 놓치는 건 이곳이 처음이고 더군다나 포시즌스라는 이름과 비용에 비하면 정말",3
"위치 시설 훌륭함, 어느곳에서나 좋은 씨티뷰, 사우나 시설 최고 코로나때문에 LL층 마켓가든을 제대로 이용못한게 아쉬웠어요",5
"체크인부터 직원분이 제가 조용하고 뷰 좋은 객실 요청했는데 직접 동행하셔서 객실 하나하나 다 친절히 설명해주셔서 좋았구요. 조식뷔페 이용 못한건 아쉽지만 수영장은 좋았어요. 다만, 객실 상태가 처음에 바닥에 이물질이 있었고 깨끗하지 못해서 실망스러웠습니다.",4
"3회 인룸 다이닝, 이유식 데우기 요청에 항시 친절하고 완벽하고 즉각적인 대응. 필요한 것이 없는지 언제나 궁금해 하는 매니저들. 대한민국 최고의 호텔 서비스.",5
"직원분들이 친절하면서 프로페셔널합니다. 룸컨디션 또한 완벽합니다. 디테일이 아주 좋은 호텔이며, 물품 하나에도 세심함이 돋보입니다. 멀리 가기 어려울때 도심속에서 푹 쉬기 좋습니다.",5
일단 객실이 고급스럽고 뷰가 맘에 들었어요. 넓고 고급스러운 느낌이 맘에 들었으나 식당 이용할때 보니 그릇을 너무 빨리 치우셔서 나가라는 뜻같았음 ㅠ 음식은 맛있었네요,4
