reviews,scores
웨스틴은 항상 최고예요~ 직원분들 응대도 그렇고.. 룸 컨디션도 그렇고.. 멀지만 쉬고싶을 때 꼭 찾게되는 이유가 있어요~,5
위치 좋고 직원들 서비스도 부담스럽지 않을 정도로 친절해서 편하게 묵고 있습니다. 특별한 날이라고 말씀드리니 초콜릿과 환구단뷰를 준비해주셨네요. 이번엔 이그제큐티브룸이었는데 다음에는 다른 룸에 묵으면서 아리아 뷔페를 같이 이용해봐야겠습니다.,5
위치 넘좋고 음식도 다 맛있었어요. 직원분들도 아주 친절하고 룸컨디션도 굿. 재방문의사 매우많습니다. 뷰 좋은데로 달라햇더니 환공단 바로보이는곳에 룸배정받았네요. 감사합니다.,5
직원분들 친절하시고 라운지 조식 맛있고 사우나 잘하고 갑니다 칵테일아워엔 만석여서 잠깐 기다릴수 있고 음식 부족하지만 빨리 채워주네요,5
"어릴 때 웨스틴조선호텔 뷔페를 유난히 좋아하시던 할아버지 덕에 매일같이 아리아를 갔다. 가서 유리잔도 많이 깨먹었고 말썽을 부려도 호텔 직원들은 언제나 친절했다. 오랜만에 이그제큐티브룸에 투숙했는데 흠잡을 데 없었다. 다들 친절했고, 좋은 기억밖에 없다. 음식도 기대만큼은 아니었지만 나쁘지 않았다. '조선' 이름이 들어가는 모든 재화 중 가장 괜찮다는 판단이 든다. 편안한 곳이다. 어릴 때나 지금이나. 여긴.",5
제가 묵었을때는 사람들이 붐비지않아서 만족스러웠고 객실컨디션도 깨끗해서 편하게 잘 묵었어요,4
만족합니다. 근처 쇼핑하기도 좋고 깔끔하고 가족끼리 가기 참좋았어요. 위치도 좋았고 서비스는 좋구요. 너무 편안히 잘쉬고갑니다!!,5
"최고입니다~~지리적인 위치도 서울 중심인 시청 옆이고 명동이 가까워서 쇼핑, 여가 등 다양한 활동이 가능하며 호텔의 시설과 직원의 서비스가 훌륭한 곳입니다~~",5
"평일이라 그런지 조식, 사우나 다 붐비지 않고 여유있게 즐길 수 있이 만족스럽고, 무엇보다 만나는 직원마다 밝은 얼굴로 친절히 응대해주니 기분좋네요~ 편안하고 따뜻한 서비스 속에서 1박 잘하고 좋은 추억 만들고 갑니다. 재방문하고 싶네요~",5
객실컨디션 좋고 친절히 응대함 또한 라운지음식 맛있구 사우나 시설 또한 프라이빗하고 만족했음,5
"이그제큐티브 방이라서 라운지이용 (칵테일아워,조식)도 좋았고 수영장 사우나도 만족스럽습니다 다들 친절하셨어요",5
내집처럼 침구잠자리가 편해서 숙면할수있어 좋았어요 쬠아쉬웠던점은 샤워가운이 넘무게감이 있어서~,4
일단 체크인 넘 늦게해서 뷰도없고 저층이고 실망 스러웠어요 ㅜㅜ 시청뷰원하고 고층선호라고 했는데. . . 일찍 갈껄 . 객실은 저번달 포시즌방문해서인지 낡은느낌?이들긴했지만 해븐리침구로 위안을삼았습니다. 자려고 누웠는데 침구에 발자국?같은 자국이 있어 실망 ㅜㅜ 11시에 직원분오셔서 급하게 교체해주셨어요~ 조금은실망 스러웠던 웨스틴첫방문기였습니다.,3
친구와 갔는데 정말 좋았어요 ㅎ 룸 컨디션도 완전 좋았고 침대도 포근하고 다시 꼭 가고 싶네요^^,5
"아내의 생일을 맞아 방문하여 숙박했습니다. 방도 넓고 뷰도 좋았습니다. 가장 좋았던 것은 수영장과 사우나 시설이었습니다. 수영하고 사우나까지 마치고, 라운지에서 술도 한잔하고 도심속에서 하루 힐링하고 가는 느낌이었습니다.",5
"아리아! 금요일 저녁 방문하였습니다. 지하 1층에 위치해 있고 7시 이후부터 손님이 많아지더군요. 전체적으로 음식 가짓수가 적으나 필요한 음식만 있으며 커피와 아이스크림이 맛있습니다. 그리고 산식 메뉴도 먹을만한데, 생선 메뉴는 조금 약해 보입니다.",4
"이그제큐티브룸에 숙박했습니다. 부산의 해수욕장이 다 보이고. 또 언덕에 집들까지 다 보입니다. 라운지는 조금 부족했으나. 걸어서 부산 포장마차 거리까지 아주 가깝습니다. (하지만 포장마차는..그냥 그랬습니다) 산책하기 좋았고. 여름이 아니라. 물놀이는 못했으나. 여름에 물놀이 하기도 좋을것 같습니다. 또 목욕탕에서 보이는 뷰와, 목욕탕 시설이 아주 좋았습니다.",5
지하철에서 가까운 호텔로 룸이 넓은 편이었다. 수영장과 사우나 시설도 넓고 좋았다 조식도 퀄리티가 좋아서 만족이었다,4
시내 중심 명동에 위치해 있어서 주변 볼거리가 많아서 좋습니다. 역사가 오래되었지만 방도 작지 않고 무엇보다 화장실이 아주 좋고 깨끗하게 잘 관리되어 있습니다. 이그제큐티브 라운지는 서비스도 좋고 준비된 음식들도 맛있었습니다. 특히 조식이 잘 준비되어 있어 맛있게 잘 먹었습니다. 빌딩숲 사이에 있어 전망은 그다지 좋지 않습니다. 전반적으로 서비스도 좋고 위치도 좋아 또 방문하고 싶습니다.,5
음식 가짓수는 작지만 음식이 하나하나 다 맛있고 헬스장 등 시설이 깔끔하고 직원 분들 서비스도 친절하고 훌륭하였습니다. 방도 좋았구요. 다시 또 오고싶은 곳입니다.,5
"세식구 와서 2박3일 잘먹고,잘쉬고가요ㅎ 직원분들 센스와 배려가 돋보이는 호텔이었어요ㅎㅎ 개인적으로ㅋ부산조선보다 더만족했네요^^ 또오고싶어요ㅠㅎ",5
"객실은 오래되어서 다소 올드하나, 음식, 직원 서비스 다 좋습니다... 시내에 있어서 모든게 편합니다... 주차하기도 좋구요... 시내에서 비즈니스 하거나 쇼핑하기 아주 좋습니다...^^",4
나인스게이트를 예약방문 하였는데 창가자리로 안내해 주시고 음식의 맛과 재료들이 너무 마음에 드는 음식이였습니다. 음식의 주재료 하나하나가 다 고급스럽고 맛이 좋았고 그에 비해 합리접인 가격으로 먹을 수 있었습니다. 또한 직원 분을의 서비스에 정말 감동을 받았고 너무 친절하십니다. 정말 만족스러운 식사를 하고 와서 재방문 할 생각입니다.,5
"호텔 예약을 하기 위해 사전에 전화를 해 궁금한 것을 물어보았습니다. 예약하는 과정에서 호텔리어분께서 매우 친절하시게 체크인/체크아웃 절차와 호텔 패키지, 주변 경치에 대해 설명해주셔서 많은 도움이 되었습니다. 그리고 교통편에 대해서도 친절하게 알려주셔서 찾아가기 쉽도록 해주셨습니다. 또 호텔 이외에도 주변 관광지와 맛집을 알려주셔서 더욱 서울 웨스틴 조선 호텔에 이끌렸습니다. 전화 예약만으로도 친절함과 상냥함이 전화 수화기를 넘어 저에게까지 전달되었습니다. 다시 한 번 감사드립니다.",5
나인스게이트를 방문하여 친구들과 식사를 하고왔는데요 예약을 했어서 그런지 자리도 매우 좋은 곳으로 해주셨고 직원분들 서비스도 매우 친절하고 정말 좋았던 것 같습니다. 이런 저런 궁금한 것들을 많이 질문하였는데도 친절하게 대해주셔서 너무 좋았습니다. 나중에 한번 더 꼭 가고싶다는 생각이 들었습니다.,5
전화로 예약하는 과정에서 제가 궁금한 정보와 패키지 상품에대한 질문을 끝까지 들어주시고 친절하게 답해주셔서 감사했습니다. 사소한 질문에도 처음부터 끝까지 친절하게 대해주셔서 좋았고 나중에 한번더 방문하고 싶을정도로 친절하셨습니다. 친절한 예약상담 감사합니다.,5
다 좋고 서비스도 훌륭하지만 약간 낡은듯한 느낌이 있네요. 그래도 매우 만족하고 지내다 갑니다.,4
오메가 평창올림픽 d-100 갈라디너 파티에 참석차 서울웨스틴조선호텔에 묵게 되었습니다 너무 편안하게 지내고 갑니다 감사합니다,5
올여름에만 조선 열번 이상 투숙한 듯 합니다만.. 데스크에 있는 남자 직원 분중 한분은 늘 기분 나쁜 표정을 짓고 계신게 영... 손님으로써 보기 좋지 않습니다. 체크인시에도 성의없고 무뚝뚝한 응대로 인해 처음부터 무척 기분이 불쾌했네요,2
호텔 예약하는 과정에서 제가 알고 싶은 정보나 요구사항을 끝까지 들어주시고 친절하게 답해주셔서 감사했습니다. 인터넷에서 조금 살펴보면 알 수 있는 정보들이었지만 인터넷이랑 별로 친하지 않은 저로서 직접 물어봤습니다. 이것저것 물어보는 질문에도 처음부터 끝까지 친절하게 대해주셔서 좋았습니다,5
가족여행으로 왔네요 도심에 있어 도심 이용이가능하네요 부페 아리아 좋네요 긋좋아묘 좋아요 좋아요 좋아요,5
"시어머님 모시고 함께 방문했어요. 주변에 명소 관광지도 많고, 호텔에서 편안한 휴식을 취하기도 매우 좋습니다. 아리아의 수준 높은 조식, 분위기 있는 사우나, 천국의 휴식을 제공해주는 헤븐리 베드~!! 정말 정말 만족스러웠어요. 다만 객실 욕조에 물을 받았더니 검은색 침전물이.. 아무래도 수도배관이 오래 되어 그런게 아닐까 싶네요. 목욕하시기 전에 물을 좀 흘려보내고 받으시면 좋을 듯 합니다.",5
"서울 시내 중심에 위치한 깨끗하고 조용한 호텔 아이와 함께 산책도 하고 명동, 시청 광장 등 주변 명소도 가까워서 더욱 좋은 여행입니다",5
"다들 친절하시고, 청결하며, 라운지 음식도 맛있어 만족합니다. 시내 접근성도 좋아 쉬고 가기 좋은 곳이네요. 다음에 또 오고 싶습니다 ^^",5
"아주 안락하고 쾌적해서 행복한 시간이었습니다~ 한가지, 불편한 점은 한국어 설명이 없다는 것이었어요 어머니가 돌아다니시면서 한국어가 없어 불편해 하셨어요..이탈리아 식당 rubico 도 맛있었구 라운지바의 재즈 공연도 너무 멋졌어요~ 모든 곳에 욕조가 있지는 않았던거 같은데 이 곳 욕조에서 피로를 풀 수 있어서 너무 좋았네요~ 객실내의 커피 머신에서 나온 커피도 너무 맛이 좋아서 좋은 아침을 시작할 수 있었네요^^",5
주말을 맞아 푹 쉬러 찾았습니다. 라운지 조식서비스는 너무 만족스러웠습니다. 사우나도 깔끔하고 편리했고 애프터눈 티 서비스도 아주 좋았습니다. 해피아워는 안주의 개념이라 식사하기엔 약간 부족한 느낌이였습니다.,4
"최근 포시즌, 시니그엘 다녀 왔지만 이곳 조선은 이번이 4번째 입니다.. 역시 품격과 역사가 있고 시청앞 정겨운 풍경은 누구도 흉내 낼수 없을거란 생각이 드네요...",5
"휴가때마다 가족과 오곤 하는데, 연휴인지라 여느 때 보다도 투숙객이 많아 라운지 등 시설 이용이 조금 번잡스러웠지만, 그래도 가족과 편안히 잘 쉬고 쾌적한 스테이였습니다. 웨스틴 조선 서울은 주변 접근성이 좋아서 선선한 가을날 산책하기도 참 좋았네요.",4
추석패키지를 이용했기때문에 어느정도의 복잡함은 예상하고 있었지만 생각보다 호텔 직원분들의 대처가 노련해서 편안한 숙박을 했다. 클럽라운지 칵테일아워는 1부보다는 2부가 이용인원이 많음,4
"연휴 마지막이라 약간 혼잡한 건 어쩔 수 없었지만, 라운지와 아리아조식 매우 만족스럽습니다. 직원 분들도 잘 응대해주셔서 편하게 쉬다 갑니다.",5
추석 연휴라 투숙객이 많지만 서울 호텔 중 언제나 최고의 만족을 주는 호텔입니다. 연식이 조금 있는 시설임에도 깔끔하게 잘 준비되어 있는 모습입니다. 모든 직원들이 친절하고 아리아 조식은 더할 나위없이 만족스럽습니다. SPG 플래티넘 회원인 저에게는 정말 최고의 호텔이라 생각합니다.,5
"주차할때부터 아 이래서 조선 호텔 조선 호텔 하는구나 라는 생각이 둘 정도로 체계적인 친절한 커스터마이징 서비스를 제공합니다. 엄마와 둘이 한 여행이였는데 저녁은 아리아 디너로 아침은 아리아 조식을 먹었는데, 디너는 정말 비싼 만큼은 질 과 맛이 다릅니다. 조식은 별로 편리하니까 먹는다는것말고는 크게 좋아요! 추천감은 아닙니다 . 워낙 브런치 조식이 다 비슷하긴 하지만 가격이 있다보니 다른 식당으로 가는것도 괜찮을것 같습니다 . 아리아 디너 강 추요!",5
결혼기념일 기념으로 2번째 방문했는데 역시나 친철은 기본 이번에는 추석이 겹쳐서 사람들이 많기는 했지만 희노애락 이벤트로 게임도 하고 마사지기계도 이용 넘 새롭고 잼났었다.,5
"놂마당, 쉼마당, 흥마당을 통한 무료 와인, 독서, 편한 휴식 공간과 편안한 잠자리도 너무좋았고. 20층 라운지에서 와인과 칵테일을 즐기는 여유도있어 매우좋았습니다.",5
이번이 세번째 방문입니다 이그제큐티브 플로어로 매번 방문했는데요 동급의 다른 호텔대비 서비스나 음식이 훌륭합니다. 직원분들도 친절하고 시설도 좋아서 매번 재 방문을 생각하며 머무르게 되네요~ 다음에는 어른들을 모시고 올 생각입니다 편안하게 잘 쉬고 갑니다 ^^,5
힐링할 수 있는 즐거운 가족 여행이 되었습니다. 추석연휴 유아를 동반한 가족손님을 위해 이그저큐티브 라운지를 2층 오키드룸으로 확대해 주셔서 잘 이용할 수 있었습니다.,5
"웨스틴 조선을 추석기간에 방문 하였습니다. 이그제큐티브룸을 사용하였는데, 침구나 서비스는 매우 만족스러웠지만 라운지 이용과 수영장 이용시 매우 혼잡하여 불편함을 겪었습니다. 수용인원을 체크하는것이 좋을듯 합니다.",5
직원분들 서비스나 시설 굉장히맘에들어요 위치도편하나 주차복잡한건빼고 모든게만족스럽습니다. 다만 사우나나 수영장이 기대보단 조금 실망스럽네요,5
서비스도 괜챦고 객실 컨디션도 아주 좋았습니다. 유희애락 패키지를 이용하였는데 놀마당 쉼마당에서 잘 놀고 틈틈히 수영장도 이용 잘 했습니다. 일단 직원분들이 친절해서 기분이 좋았습니다. 수영장의 메인풀에 한쪽 레일을 치우고 가족들이 놀수 있게 신경쓴 부분도 마음에 들었습니다. 아리아 조식은 워낙 유명한지라 말할 것도 없겠죠~^^ 기회가 된다면 꼭 이곳으로 다시 오고 싶네요~^^,5
추석 유희애락 패키지에 와서 신세계경험하고 가네요. 라운지에서 애프터눈티도 우아하게 마시고 저녁엔 라이브를 들으며 와인3종과 하몽과 치즈를 즐김. 전신안마기에 만화책쉼터까지 이 모든게 패키지라니!! 누리고 즐기고 여유로움에 힐링도 되니 추천하고 싶습니다,5
"추석 다음날 친구들과 함께온 웨스틴조선 호텔. 유희애락패키지로 즐거운 시간이었어요. 쉼마당 놂마당에서의 휴식도 좋았고, 아침 조식도 맛있어요! 특히, 이그제큐티브라운지 서비스로 이용한 흥마당에서 좋은 추억을 만들고 갑니다. 다음 연휴에도 또 오고 싶네요~",5
"아기의 첫돌을 축하할겸, 긴 연휴를 맞아 쉴 수 있는 곳을 알아보다 선택한 웨스틴 조선 호텔!! 기간은 2박 3일!! 위치도 워낙 좋아 서울시청이나 광화문 동대문 명동 등등 어디든 쉽게 바로 이동할 수 있었어요. 아리아 조식 뷔페가 워낙 맛나다고 소문이 났던 터라 기대하고 있었어요. 그 기대에 걸맞게 ! 만족스러웠답니다. 특히나 프렌치토스트와 커피!! 너무 맛있어서 몇번이고 먹었어요. 청소나 청결도에서도 으뜸이었어요. 불편사항이 있으면 즉시 해결해주시고, 객실비품도 넉넉히 채워놔주셔서 기분좋게 이용하고 왔답니다. 사우나, 체련장, 수영장도 마음껏 이용할 수 있었는데, 워낙 깔끔하고 왠만한 비품들은 다 구비되어 있어서 정말 몸만 가면 되었답니다. 직원분들도 정말 다 친절하셔서 처음부터 끝까지 즐겁게 보내다 왔네요. 칵테일 아워나 애프터눈 아워도 꼭 이용해보세요~ 정말 즐겁게, 어쩜 우리집보다 편히 쉬다 올 수 있을 거에요.ㅎ",5
2층 오키드룸의 조식은 임시적이라고 하더라도 웨스틴조선의 서비스 이미지를 저하시키기에 충분했습니다. 수용인원때문에 어쩔수 없다면 20층 라운지 조식서비스와의 차이를 커버할수 있도록 충분하게 보강되어야 할것 같습니다. 2층 조식은 호텔 서비스라기보단 거의 웨딩홀 돌잔치 뷔페 분위기 수준이었어요.. 그외는 웨스틴조선의 명성답게 모두 훌륭했습니다,4
"연휴를 이용해서 서울 나들이도 할겸 1박을 예약했습니다. 부산에도 웨스턴조선이 있지만 집도 부산이라 굳이 1박을 해본적은 없는데 여기에서 1박을 하고나니 기대보다 더 좋아서 부산도 이용해보고 싶네요. 사우나 시설이나 수영장이 조금 작지만 아늑하게 즐기기엔 전혀 무리가 없네요. 고객을 생각한 용품 하나하나, 직원들의 서비스도 완전 만족스럽습니다. 도심에 위치하고 있어 옆 빌딩에 가려져 뷰가 확 트이진 않았지만 그래도 다음번 재방문 의사 100 입니다. 담휴가때는 2박으로 하려구요 웨스턴조선 추천합니다~",5
시내에 있어 명동 관광이나 쇼핑하기에 최적이고 푹 쉬었다 가기에 정말 좋은 곳 이네요 가족과 와서 잠시 쉬어가기에 좋은 장소 입니다,5
"연휴라 사람이 많을것을 예상하고 걱정하며 왔는데, 생각보다 체크인도 오래 걸리지 않았고 라운지도 대기없이 바로 이용 가능해 좋았습니다. 아직 티어가 없어 방배정에 아쉬움이 남지만... 그걸 만회할정도로 직원분들의 친절에 감동받고, 명절 스트레스 확실히 풀고 갑니다.",5
"추석연휴 지방을 오가며 수고한 남편과 함께 편안하게 맛있는 음식과 색다른 놂마당에서의 경험은 너무 좋았습니다~! 내년에는 시부모님, 친정식구들을 초대하여 행복한 시간 보내고 싶습니다!",5
친구들과명절연휴 보내러 왔다가 잘먹고잘쉬엇습니다 먹을것도 다양하고 조식도깔끔하게 나오고 맛있게 잘먹엇습니다 다음에 기회되면또 오고싶네요,3
"명절 호캉스로 친구들과 놀러왔는데 방이 준비가 덜 되어 1시간가량 늦은 체크인을 하게됐습니다. 방 자체는 크고 좋았지만 투숙객이 몰려 바쁘셨는지 어메니티나 컵 등이 3인 셋팅이 제대로 되어있지 않아 이런 부분에서 살짝 아쉬운 부분이 있었으나 전화하자마자 금세 달려오셔서 해결해주셨습니다 ^^ 침구는 헤븐리라는 이름답게 온몸을 감싸주는 부드럽고 편안한 침구였고, 칵테일 아워나 애프터눈 스낵에서는 명동거리를 창밖으로 감상하며 좋은것들을 마음껏 먹고 마시고 쉴 수 있어 아주 만족스럽고 행복한 1박이 됐습니다. 명동에 온다면 꼭 묵어봐야 할 호텔!",4
"아이와 함께 즐겁게 여행할 수 있었습니다. 연휴 기간이어서 그런지 체크인 시간에 줄서서 기다리는 번거로움이 있었으나, 감수할만큼 쾌적하고 조용하게 가족여행을 즐길 수 있어 좋았습니다. 도심 속인데도 불구하고 소음도 적고 주변에 편의시설도 가까워 잘 쉬다 갈 수 있었습니다. 빌딩이 가리고 있어 창밖 풍경은 아쉬웠습니다.",4
14개월 아기와 같이와서 걱정했는데 너무 편하게 잘되어있어서 잘놀다갑니다 호텔밖을 나갈필요가없네요 다음에 또 오고싶어요 친절하게 잘 대해주셔서 감사해요♡,5
덕수궁 창경궁 가깝게 둘러보기좋아요 직원친절하고 좋아요 수영장은 오후시간대 이용했는데 그때가 사람이 제일많아서 제대로 못즐겨서 아쉽네요,4
"10월3일부터 5일까지 추석연휴동안 2박을 하였습니다 긴연휴여서 많은 인파에도불구하고 조선호텔 특유의 서비스를 지속적으로 유지하는 것을 보고 너무나 인상깊었습니다 조식,라운지서비스,수영장,사우나 모두 만족하였습니다 다음번에도 조선호텔에서 머물고 싶네요ㅎ",5
"처음 방문해보는 호텔이었는데 접근성과 서비스가 가장 마음에 들었습니다. 무엇보다 깨끗한 사우나, 그리고 친절과 신선함이 있었던 조식 서비스가 가장 인상에 남습니다. 다음에 다시 오게 된다면 수영장과 짐서비스를 이용해볼 생각입니다. 그만큼 또 방문하고 싶고, 지불한 금액이 아깝지 않았습니다. 다만 창밖으로 보이는 곳이 높은 건물뿐이라 조금 아쉬웠습니다....",3
가족이 첫 추석날 묵었는데 시청 광화문 명동 가까워서 좋고 밤에 창으로 달도 잘 보고 아빠와 아들은 신나게 수영장에서 놀고 저는 체력장 가서 운동하고 근처에 식당들도 많고 편의점도 가깝고 좋았네요 킹 사이즈 침대에 우리 가족 잘 잤네요,4
연휴에 휴식차 가족과 방문했는데 후회없이 하루 묵다 갑니다 침구와 수영장 등 시설도 훌륭하고 무엇보다 음식이 너무나 맛있어요 클럽라운지의 커피와 다과까지도 완벽하네요 🙆,5
아이들 과 함께 쥬니어 스위트 룸에서 지냈습니다. 체크인 부터 직원들의 새심한 배려를 느낄 수있었고 오래된 호텔임에도 굉장히 관리가 잘 되고 있음을 알 수 있었습니다. 수영장 시설도 훌륭하고 무엇보다 명동 접근성이 굉장히 좋아 즐거운 스테이를 했습니다. 다시 방문하고 싶은 호텔입니다.,5
추석연휴 중에 유희애락 패키지로 잘 쉬다 갑니다 아이들이 매우 즐거워하네요 수영장도 매우 좋았고 아침 조식도 맛있어요! 직원분들도 매우 친절하시구요!,5
"명동,광화문,덕수궁등 도보로 모두 돌아보기 편한 위치와 깔끔하고 맛있는 조식등 만족스러운 여행이 되었습니다.다음에도 이용하고 싶네요.",5
"서울중심에 위치해있어 남산타워, 덕수궁, 삼청동등 핫스팟과의 거리가 가까움. 20층 라운지바 이용시 분위기가 좋으며 안주종류가 알참. 다양한 와인과 술을 접할 수 있어 만족스러움. 조식이 종류가 다양하며 직원들의 서비스가 만족스러움",4
신랑과 함께한 휴일 침실따로 거실따로 넓고 욕실도 두개인 스윗룸 너무맘에 듭니다~~ 라운지에서 깔끔하고 조은분위기속 디저트와 커피가 죙일~♥ 사우나는 일인씩 독립적인 부스가 최고 행복햇어요 아리아석식메뉴짱 완전맛나요,5
가족들 모두 만족할정도로 훌륭한 서비스 입니다. 어느 직원분 할거없이 최상의 서비스로 투숙내내 편안함주셔서 감사하네요 ^ ^ 라운지에서도 푸드.주류 모두 만족했구요 호텔.동선도 편안해서 이동간에도 수월했습니다,5
일행중 생일이 있었는데 와인과 치즈도 셋팅해주시고^^ 침구는 좋은거 말할필요도없구요 ㅎㅎ 저녁에 라운지가 붐비긴 했지만 어쩔수 없는부분 같고 ㅎ잘 쉬다왓네요,5
추석 연휴를 맞아 편히 쉬려고 잠시 들렀습니다. 객실도 조용하고 저녁 이그제큐티브 라운지에서도 즐거운 시간 보냈습니다.,5
전체적으로 깨끗하고 포근한 느낌이 좋았어요. 지갑을 잃어버린줄 알고 당황했는데 여러 직원분들이 적극적으로 도와주셔서 잘 찾았습니다. 또한 친구 생일인 것을 체크인후 알려드렸더니 와인과 안주 등 챙겨주셔서 깜짝 생일파티를 할 수있었습니다. 덕분에 좋은 추억 남기고 갑니다,4
무엇보다 시내중심이라 교통이 편리하고 롯데백화점 본점이 바로앞이라 쇼핑하기 너무 좋네요!! 이그제큐티브룸 이용했는데 생각보다 라운지도 혼잡하지않고 좋았어요. 음식가짓수는 많지않았지만 맛있게 먹었네요~ 패키지로 와인 두병 교환권받아서 저녁에 먹었는데 맛있었습니다. 그리고 사우나가 유명하다고해서 이용하러갔는데 조금 복잡해보였지만 직원분들이 상세히 알려주셔서 사우나.수영장 알차게 이용했네요~ 듣던대로 너무너무 좋았습니다:) 룸컨디션은 살짝 올드하긴했지만 그만큼 전통있는 호텔이라 또 이런분위기가 어울리는거아닌가싶어요~ 머무는내내 직원분들 모두 친절하게 응대해주셔서 좋았어요. 다음에 또 방문할께요~^^,5
"친절히 응대해 주시고, 시설 모두 깨끗하고 조용해서 좋았습니다. 아리아는 품목수가 살짝 적다는 느낌이 들었지만 모든 메뉴의 맛은 역시나 훌륭합니다. 사우나도 프라이빗한 공간이 많이 마련되어 있어 사용하기 편리했습니다. 또 방문하고 싶습니다, 고맙습니다.",5
